tweet_id,timestamp,source,text,expanded_urls,rating_numerator,rating_denominator,name,dog_stage,dog_breed_p,retweet_count,favorite_count
799063482566066176,2016-11-17 01:35:54+00:00,Twitter for iPhone,This is Mister. He only wears the most fashionable af headwear. 11/10 h*ckin stylish ,"https://twitter.com/dog_rates/status/799063482566066176/photo/1,https://twitter.com/dog_rates/status/799063482566066176/photo/1,https://twitter.com/dog_rates/status/799063482566066176/photo/1,https://twitter.com/dog_rates/status/799063482566066176/photo/1",11,10,Mister,,norfolk_terrier,2863,9058
798933969379225600,2016-11-16 17:01:16+00:00,Twitter for iPhone,This is Iroh. He's in a predicament. 12/10 someone help him ,"https://twitter.com/dog_rates/status/798933969379225600/photo/1,https://twitter.com/dog_rates/status/798933969379225600/photo/1",12,10,Iroh,,siberian_husky,5203,14712
798925684722855936,2016-11-16 16:28:21+00:00,Twitter for iPhone,This is Shadow. He's a firm believer that they're all good dogs. H*ckin passionate about it too. 11/10 I stand with Shadow ,https://twitter.com/dog_rates/status/798925684722855936/photo/1,11,10,Shadow,,west_highland_white_terrier,1663,8246
798209839306514432,2016-11-14 17:03:50+00:00,Twitter for iPhone,This is Cooper. His bow tie was too heavy for the front so he moved it to the side. Balanced af now. 13/10 ,https://twitter.com/dog_rates/status/798209839306514432/photo/1,13,10,Cooper,,pekinese,2954,11548
797971864723324932,2016-11-14 01:18:12+00:00,Twitter for iPhone,Here's a helicopter pupper. He takes off at random. H*ckin hard to control. 12/10 rare af ,"https://twitter.com/dog_rates/status/797971864723324932/photo/1,https://twitter.com/dog_rates/status/797971864723324932/photo/1",12,10,None,pupper,american_staffordshire_terrier,3652,13018
797545162159308800,2016-11-12 21:02:38+00:00,Twitter for iPhone,This is Cassie. She steals things. Guilt increases slightly each time. 12/10 would forgive almost immediately ,"https://twitter.com/dog_rates/status/797545162159308800/photo/1,https://twitter.com/dog_rates/status/797545162159308800/photo/1,https://twitter.com/dog_rates/status/797545162159308800/photo/1,https://twitter.com/dog_rates/status/797545162159308800/photo/1",12,10,Cassie,,pembroke,5656,16198
797236660651966464,2016-11-12 00:36:46+00:00,Twitter for iPhone,This is Pancake. She loves Batman and winks like a h*ckin champ. 12/10 real crowd pleaser ,"https://twitter.com/dog_rates/status/797236660651966464/photo/1,https://twitter.com/dog_rates/status/797236660651966464/photo/1",12,10,Pancake,,collie,7726,22328
796865951799083009,2016-11-11 00:03:42+00:00,Twitter for iPhone,This is Tyr. He's just checking on you. Nifty af tongue slip. 12/10 would absolutely pet ,https://twitter.com/dog_rates/status/796865951799083009/photo/1,12,10,Tyr,,cardigan,2198,8564
796759840936919040,2016-11-10 17:02:03+00:00,Twitter for iPhone,Say hello to Romeo. He was just told that it's too cold for the pool. H*ckin nonsense. 11/10 would help fill up ,"https://twitter.com/dog_rates/status/796759840936919040/photo/1,https://twitter.com/dog_rates/status/796759840936919040/photo/1",11,10,Romeo,,american_staffordshire_terrier,3562,13256
796484825502875648,2016-11-09 22:49:15+00:00,Twitter for iPhone,Here's a sleepy doggo that requested some assistance. 12/10 would carry everywhere ,https://twitter.com/dog_rates/status/796484825502875648/photo/1,12,10,None,doggo,cocker_spaniel,2042,8472
796387464403357696,2016-11-09 16:22:22+00:00,Twitter for iPhone,This is Snicku. He's having trouble reading because he's a dog. Glasses only helped a little. Nap preferred. 12/10 would snug well ,"https://twitter.com/dog_rates/status/796387464403357696/photo/1,https://twitter.com/dog_rates/status/796387464403357696/photo/1",12,10,Snicku,,pekinese,4861,12334
796149749086875649,2016-11-09 00:37:46+00:00,Twitter for iPhone,This is Ruby. She just turned on the news. Officially terrified. 11/10 deep breaths Ruby ,"https://twitter.com/dog_rates/status/796149749086875649/photo/1,https://twitter.com/dog_rates/status/796149749086875649/photo/1",11,10,Ruby,,golden_retriever,16628,36177
796116448414461957,2016-11-08 22:25:27+00:00,Twitter for iPhone,I didn't believe it at first but now I can see that voter fraud is a serious h*ckin issue. 11/10 ,https://twitter.com/dog_rates/status/796116448414461957/photo/1,11,10,None,,cardigan,2813,10139
796080075804475393,2016-11-08 20:00:55+00:00,Twitter for iPhone,This is Yogi. He's 98% floof. Snuggable af. 12/10 ,https://twitter.com/dog_rates/status/796080075804475393/photo/1,12,10,Yogi,,chow,2703,9469
796031486298386433,2016-11-08 16:47:50+00:00,Twitter for iPhone,This is Daisy. She's here to make your day better. 13/10 mission h*ckin successful ,https://twitter.com/dog_rates/status/796031486298386433/photo/1,13,10,Daisy,,golden_retriever,4284,12071
795464331001561088,2016-11-07 03:14:10+00:00,Twitter for iPhone,Elder doggo does a splash. Both 13/10 incredible stuff ,https://twitter.com/dog_rates/status/795464331001561088/video/1,13,10,None,doggo,golden_retriever,27728,55683
795400264262053889,2016-11-06 22:59:35+00:00,Twitter for iPhone,This is Brody. He's trying to make the same face as the football. 12/10 ,"https://twitter.com/dog_rates/status/795400264262053889/photo/1,https://twitter.com/dog_rates/status/795400264262053889/photo/1,https://twitter.com/dog_rates/status/795400264262053889/photo/1,https://twitter.com/dog_rates/status/795400264262053889/photo/1",12,10,Brody,,golden_retriever,3323,11270
794926597468000259,2016-11-05 15:37:24+00:00,Twitter for iPhone,This is Mack. He's rather h*ckin sleepy. Exceptional ears. 12/10 would boop ,https://twitter.com/dog_rates/status/794926597468000259/photo/1,12,10,Mack,,toy_poodle,2697,11492
794332329137291264,2016-11-04 00:15:59+00:00,Twitter for iPhone,This is Nimbus (like the cloud). He just bought this fancy af duck raincoat. Only protects one ear tho. 12/10 so h*ckin floofy ,https://twitter.com/dog_rates/status/794332329137291264/photo/1,12,10,Nimbus,,samoyed,3088,10686
793962221541933056,2016-11-02 23:45:19+00:00,Twitter for iPhone,This is Maximus. His face is stuck like that. Tragic really. Great tongue tho. 12/10 would pet firmly ,"https://twitter.com/dog_rates/status/793962221541933056/photo/1,https://twitter.com/dog_rates/status/793962221541933056/photo/1",12,10,Maximus,,labrador_retriever,5711,18910
793845145112371200,2016-11-02 16:00:06+00:00,Twitter for iPhone,This is Clark. He was just caught wearing pants. 13/10 game-changing af ,https://twitter.com/dog_rates/status/793845145112371200/photo/1,13,10,Clark,,old_english_sheepdog,2187,10295
793601777308463104,2016-11-01 23:53:02+00:00,Twitter for iPhone,This is Dobby. I can't stop looking at her feet. 12/10 would absolutely snug ,https://twitter.com/dog_rates/status/793601777308463104/photo/1,12,10,Dobby,,miniature_pinscher,1908,8926
793500921481273345,2016-11-01 17:12:16+00:00,Twitter for iPhone,This is Fiona. She's an extremely mediocre copilot. Very distracting. Wink makes up for all the missed turns. 12/10 ,"https://twitter.com/dog_rates/status/793500921481273345/photo/1,https://twitter.com/dog_rates/status/793500921481273345/photo/1",12,10,Fiona,,golden_retriever,2786,11953
793286476301799424,2016-11-01 03:00:09+00:00,Twitter for iPhone,This is Moreton. He's the Good Boy Who Lived. 13/10 magical as h*ck ,"https://twitter.com/dog_rates/status/793286476301799424/photo/1,https://twitter.com/dog_rates/status/793286476301799424/photo/1",13,10,Moreton,,afghan_hound,10723,27597
793271401113350145,2016-11-01 02:00:14+00:00,Twitter for iPhone,Meet Dave. It's his favorite day of the year. He gets to fulfill his dream of being a dinosaur. 12/10 inspirational af ,https://twitter.com/dog_rates/status/793271401113350145/photo/1,12,10,Dave,,siberian_husky,2763,9677
793256262322548741,2016-11-01 01:00:05+00:00,Twitter for iPhone,Oh h*ck look at this spookling right here. Fright level off the charts. 12/10 sufficiently spooked ,https://twitter.com/dog_rates/status/793256262322548741/photo/1,12,10,None,,basset,9714,22350
793241302385262592,2016-11-01 00:00:38+00:00,Twitter for iPhone,This is Tucker. He's out here bustin h*ckin ghosts. 13/10 dedicated af ,https://twitter.com/dog_rates/status/793241302385262592/photo/1,13,10,Tucker,,golden_retriever,3812,11780
793226087023144960,2016-10-31 23:00:11+00:00,Twitter for iPhone,"This is Juno. She spooked me up real good, but only to get my attention. Above average handwriting for a dog I think. 11/10 ","https://twitter.com/dog_rates/status/793226087023144960/photo/1,https://twitter.com/dog_rates/status/793226087023144960/photo/1,https://twitter.com/dog_rates/status/793226087023144960/photo/1",11,10,Juno,,wire-haired_fox_terrier,3338,11001
793210959003287553,2016-10-31 22:00:04+00:00,Twitter for iPhone,This is Maude. She's the h*ckin happiest wasp you've ever seen. 10/10 would pet with caution ,https://twitter.com/dog_rates/status/793210959003287553/photo/1,10,10,Maude,,french_bulldog,3301,9997
793195938047070209,2016-10-31 21:00:23+00:00,Twitter for iPhone,Say hello to Lily. She's pupset that her costume doesn't fit as well as last year. 12/10 poor puppo ,"https://twitter.com/dog_rates/status/793195938047070209/photo/1,https://twitter.com/dog_rates/status/793195938047070209/photo/1",12,10,Lily,puppo,labrador_retriever,6547,17063
793180763617361921,2016-10-31 20:00:05+00:00,Twitter for iPhone,This is Newt. He's a strawberry. 11/10 ,https://twitter.com/dog_rates/status/793180763617361921/photo/1,11,10,Newt,,lakeland_terrier,2310,7740
793165685325201412,2016-10-31 19:00:10+00:00,Twitter for iPhone,This is Benji. He's Air Bud. It's a low effort costume but he pulls it off rather h*ckin well. 12/10 would happily get dunked on ,https://twitter.com/dog_rates/status/793165685325201412/photo/1,12,10,Benji,,golden_retriever,3238,10478
793150605191548928,2016-10-31 18:00:14+00:00,Twitter for iPhone,This is Nida. She's a free elf. Waited so long for this day. 11/10 ,https://twitter.com/dog_rates/status/793150605191548928/photo/1,11,10,Nida,,italian_greyhound,1984,6909
793120401413079041,2016-10-31 16:00:13+00:00,Twitter for iPhone,"This is Robin. She's desperately trying to do me a frighten, but her tongue drastically decreases her spook value. Still 11/10 great effort ",https://twitter.com/dog_rates/status/793120401413079041/photo/1,11,10,Robin,,labrador_retriever,4551,14202
792883833364439040,2016-10-31 00:20:11+00:00,Twitter for iPhone,This is Bailey. She's rather h*ckin hype for Halloween tomorrow. Carved those pupkins herself. 12/10 ,"https://twitter.com/dog_rates/status/792883833364439040/photo/1,https://twitter.com/dog_rates/status/792883833364439040/photo/1,https://twitter.com/dog_rates/status/792883833364439040/photo/1,https://twitter.com/dog_rates/status/792883833364439040/photo/1",12,10,Bailey,,standard_poodle,4964,12666
792773781206999040,2016-10-30 17:02:53+00:00,Twitter for iPhone,This is Monster. Not an actual monster tho. He's showing you his tongue. Very impressive Monster. 12/10 would snug ,https://twitter.com/dog_rates/status/792773781206999040/photo/1,12,10,Monster,,yorkshire_terrier,1963,8209
792394556390137856,2016-10-29 15:55:58+00:00,Twitter for iPhone,Meet BeBe. She rocks the messy bun of your dreams. H*ckin flawless. 12/10 would watch her tutorial ,"https://twitter.com/dog_rates/status/792394556390137856/photo/1,https://twitter.com/dog_rates/status/792394556390137856/photo/1",12,10,BeBe,,cocker_spaniel,4998,15128
792050063153438720,2016-10-28 17:07:05+00:00,Twitter for iPhone,This is Remus. He's a mop that came to life. Can't see anything. Constantly trips over himself. Still a very good dog. 11/10 ,"https://twitter.com/dog_rates/status/792050063153438720/photo/1,https://twitter.com/dog_rates/status/792050063153438720/photo/1",11,10,Remus,,komondor,2088,8029
791672322847637504,2016-10-27 16:06:04+00:00,Twitter for iPhone,When she says you're a good boy and you know you're a good boy because you're a good boy. 13/10 ,https://twitter.com/dog_rates/status/791672322847637504/photo/1,13,10,None,,golden_retriever,3661,13129
791406955684368384,2016-10-26 22:31:36+00:00,Twitter for iPhone,Say hello to Levi. He's a Madagascan Butterbop. One of the more docile Butterbops I've seen. 12/10 would give all the pets ,"https://twitter.com/dog_rates/status/791406955684368384/photo/1,https://twitter.com/dog_rates/status/791406955684368384/photo/1,https://twitter.com/dog_rates/status/791406955684368384/photo/1,https://twitter.com/dog_rates/status/791406955684368384/photo/1",12,10,Levi,,pembroke,4797,14670
791312159183634433,2016-10-26 16:14:55+00:00,Twitter for iPhone,This is Mabel. She's super h*ckin smol. Portable af. Comes with the smol shoe. 12/10 would keep in frocket ,"https://twitter.com/dog_rates/status/791312159183634433/photo/1,https://twitter.com/dog_rates/status/791312159183634433/photo/1,https://twitter.com/dog_rates/status/791312159183634433/photo/1,https://twitter.com/dog_rates/status/791312159183634433/photo/1",12,10,Mabel,,miniature_pinscher,2963,9841
790987426131050500,2016-10-25 18:44:32+00:00,Twitter for iPhone,This is Misty. She has a cowboy hat on her nose. 12/10 ,https://twitter.com/dog_rates/status/790987426131050500/photo/1,12,10,Misty,,cocker_spaniel,2483,11089
790946055508652032,2016-10-25 16:00:09+00:00,Twitter for iPhone,This is Betty. She's assisting with the dishes. Such a good puppo. 12/10 h*ckin helpful af ,https://twitter.com/dog_rates/status/790946055508652032/photo/1,12,10,Betty,puppo,golden_retriever,5496,18601
790698755171364864,2016-10-24 23:37:28+00:00,Twitter for iPhone,This is Mosby. He appears to be rather h*ckin snuggable af. 12/10 keep it up Mosby ,https://twitter.com/dog_rates/status/790698755171364864/photo/1,12,10,Mosby,,bernese_mountain_dog,2203,9158
790581949425475584,2016-10-24 15:53:19+00:00,Twitter for iPhone,This is Duke. He sneaks into the fridge sometimes. It's his safe place. 11/10 would give little jacket if necessary ,"https://twitter.com/dog_rates/status/790581949425475584/photo/1,https://twitter.com/dog_rates/status/790581949425475584/photo/1",11,10,Duke,,malinois,8183,22473
790337589677002753,2016-10-23 23:42:19+00:00,Twitter for iPhone,Meet Maggie. She can hear your cells divide. 12/10 can also probably fly ,https://twitter.com/dog_rates/status/790337589677002753/photo/1,12,10,Maggie,,pembroke,2167,8740
790277117346975746,2016-10-23 19:42:02+00:00,Twitter for iPhone,This is Bruce. He never backs down from a challenge. 11/10 you got this Bruce ,https://twitter.com/dog_rates/status/790277117346975746/photo/1,11,10,Bruce,,labrador_retriever,3732,14081
789986466051088384,2016-10-23 00:27:05+00:00,Twitter for iPhone,This is Happy. He's a bathtub reviewer. Seems to be pleased with this one. 12/10 ,https://twitter.com/dog_rates/status/789986466051088384/photo/1,12,10,Happy,,golden_retriever,2704,10369
789628658055020548,2016-10-22 00:45:17+00:00,Twitter for iPhone,This is Eli. He can fly. 13/10 magical af ,https://twitter.com/dog_rates/status/789628658055020548/photo/1,13,10,Eli,,chow,2080,8448
789599242079838210,2016-10-21 22:48:24+00:00,Twitter for iPhone,This is Brownie. She's wearing a Halloween themed onesie. 12/10 festive af ,"https://twitter.com/dog_rates/status/789599242079838210/photo/1,https://twitter.com/dog_rates/status/789599242079838210/photo/1",12,10,Brownie,,chesapeake_bay_retriever,2279,7620
789530877013393408,2016-10-21 18:16:44+00:00,Twitter for iPhone,This is Rizzy. She smiles a lot. 12/10 contagious af ,"https://twitter.com/dog_rates/status/789530877013393408/photo/1,https://twitter.com/dog_rates/status/789530877013393408/photo/1,https://twitter.com/dog_rates/status/789530877013393408/photo/1",12,10,Rizzy,,schipperke,3942,13188
789268448748703744,2016-10-21 00:53:56+00:00,Twitter for iPhone,This is Stella. She's happier than I will ever be. 10/10 would trade lives with ,https://twitter.com/dog_rates/status/789268448748703744/photo/1,10,10,Stella,,malamute,3014,10196
789137962068021249,2016-10-20 16:15:26+00:00,Twitter for iPhone,This is Bo. He's a West Congolese Bugaboop Snuggle. Rather exotic. Master of the head tilt. 12/10 would pay to pet ,"https://twitter.com/dog_rates/status/789137962068021249/photo/1,https://twitter.com/dog_rates/status/789137962068021249/photo/1,https://twitter.com/dog_rates/status/789137962068021249/photo/1",12,10,Bo,,chihuahua,3244,10875
788908386943430656,2016-10-20 01:03:11+00:00,Twitter for iPhone,"This is Lucy. She destroyed not one, but two remotes trying to turn off the debate. 11/10 relatable af ",https://twitter.com/dog_rates/status/788908386943430656/photo/1,11,10,Lucy,,golden_retriever,14409,30653
788765914992902144,2016-10-19 15:37:03+00:00,Twitter for iPhone,This is Butter. She can have whatever she wants forever. 12/10 would hug softly ,https://twitter.com/dog_rates/status/788765914992902144/photo/1,12,10,Butter,,cocker_spaniel,12014,30658
788412144018661376,2016-10-18 16:11:17+00:00,Twitter for iPhone,This is Dexter. He breaks hearts for a living. 11/10 h*ckin handsome af ,"https://twitter.com/dog_rates/status/788412144018661376/photo/1,https://twitter.com/dog_rates/status/788412144018661376/photo/1",11,10,Dexter,,golden_retriever,5990,16060
788178268662984705,2016-10-18 00:41:57+00:00,Twitter for iPhone,Atlas is back and this time he's got doggles. Still 13/10 solarly conscious af ,"https://twitter.com/dog_rates/status/788178268662984705/photo/1,https://twitter.com/dog_rates/status/788178268662984705/photo/1,https://twitter.com/dog_rates/status/788178268662984705/photo/1,https://twitter.com/dog_rates/status/788178268662984705/photo/1",13,10,None,,samoyed,2488,8100
788150585577050112,2016-10-17 22:51:57+00:00,Twitter for iPhone,This is Leo. He's a golden chow. Rather h*ckin rare. 13/10 would give extra pats ,"https://twitter.com/dog_rates/status/788150585577050112/photo/1,https://twitter.com/dog_rates/status/788150585577050112/photo/1,https://twitter.com/dog_rates/status/788150585577050112/photo/1,https://twitter.com/dog_rates/status/788150585577050112/photo/1",13,10,Leo,,chow,1510,6865
787810552592695296,2016-10-17 00:20:47+00:00,Twitter for iPhone,This is Frank. He wears sunglasses and walks himself. 11/10 I'll never be this cool or independent ,"https://twitter.com/dog_rates/status/787810552592695296/photo/1,https://twitter.com/dog_rates/status/787810552592695296/photo/1",11,10,Frank,,pug,3540,9717
787717603741622272,2016-10-16 18:11:26+00:00,Twitter for iPhone,This is Tonks. She is a service puppo. Can hear a caterpillar hiccup from 7 miles away. 13/10 would follow anywhere ,"https://twitter.com/dog_rates/status/787717603741622272/photo/1,https://twitter.com/dog_rates/status/787717603741622272/photo/1,https://twitter.com/dog_rates/status/787717603741622272/photo/1,https://twitter.com/dog_rates/status/787717603741622272/photo/1",13,10,Tonks,puppo,german_shepherd,3240,11416
787397959788929025,2016-10-15 21:01:17+00:00,Twitter for iPhone,This is Moose. He's rather h*ckin dangerous (you can tell by the collar). 11/10 would still attempt to snug ,https://twitter.com/dog_rates/status/787397959788929025/photo/1,11,10,Moose,,chihuahua,3300,12120
787322443945877504,2016-10-15 16:01:13+00:00,Twitter for iPhone,This is Lincoln. He forgot to use his blinker when he changed lanes just now. Guilty as h*ck. Still 10/10 ,https://twitter.com/dog_rates/status/787322443945877504/photo/1,10,10,Lincoln,,golden_retriever,2032,8726
786963064373534720,2016-10-14 16:13:10+00:00,Twitter for iPhone,This is Rory. He's got an interview in a few minutes. Looking spiffy af. Nervous as h*ck tho. 12/10 would hire ,https://twitter.com/dog_rates/status/786963064373534720/photo/1,12,10,Rory,,golden_retriever,9327,29725
786709082849828864,2016-10-13 23:23:56+00:00,Twitter for iPhone,"This is Logan, the Chow who lived. He solemnly swears he's up to lots of good. H*ckin magical af 9.75/10 ",https://twitter.com/dog_rates/status/786709082849828864/photo/1,75,10,Logan,,pomeranian,7069,20296
786664955043049472,2016-10-13 20:28:35+00:00,Twitter for iPhone,"""Honestly Kathleen I just want more Ken Bone"" 12/10 ",https://twitter.com/dog_rates/status/786664955043049472/photo/1,12,10,None,,leonberg,2996,11957
786595970293370880,2016-10-13 15:54:28+00:00,Twitter for iPhone,This is Dale. He's a real spookster. Did me quite the frighten. 11/10 not too spooky to pet tho ,https://twitter.com/dog_rates/status/786595970293370880/photo/1,11,10,Dale,,pembroke,3601,10497
786363235746385920,2016-10-13 00:29:39+00:00,Twitter for iPhone,This is Rizzo. He has many talents. A true renaissance doggo. 13/10 entertaining af ,"https://twitter.com/dog_rates/status/786363235746385920/photo/1,https://twitter.com/dog_rates/status/786363235746385920/photo/1,https://twitter.com/dog_rates/status/786363235746385920/photo/1,https://twitter.com/dog_rates/status/786363235746385920/photo/1",13,10,Rizzo,doggo,golden_retriever,4072,12189
786233965241827333,2016-10-12 15:55:59+00:00,Twitter for iPhone,This is Mattie. She's extremely dangerous. Will bite your h*ckin finger right off. Still 11/10 would pet with caution ,https://twitter.com/dog_rates/status/786233965241827333/photo/1,11,10,Mattie,,labrador_retriever,5571,17178
785927819176054784,2016-10-11 19:39:28+00:00,Twitter for iPhone,This is Lucy. She's strives to be the best potato she can be. 12/10 would boop ,https://twitter.com/dog_rates/status/785927819176054784/photo/1,12,10,Lucy,,toy_poodle,3652,12696
785872687017132033,2016-10-11 16:00:24+00:00,Twitter for iPhone,Meet Rusty. He appears to be rather h*ckin fluffy. Also downright adorable af. 12/10 would rub my face against his ,https://twitter.com/dog_rates/status/785872687017132033/video/1,12,10,Rusty,,great_pyrenees,2130,7489
785533386513321988,2016-10-10 17:32:08+00:00,Twitter for iPhone,This is Dallas. Her tongue is ridiculous. 11/10 h*ckin proud af ,"https://twitter.com/dog_rates/status/785533386513321988/photo/1,https://twitter.com/dog_rates/status/785533386513321988/photo/1",11,10,Dallas,,miniature_pinscher,2334,10183
785264754247995392,2016-10-09 23:44:41+00:00,Twitter for iPhone,This is Doc. He requested to be carried around like that. 12/10 anything for Doc ,https://twitter.com/dog_rates/status/785264754247995392/photo/1,12,10,Doc,,chow,1911,8128
785170936622350336,2016-10-09 17:31:53+00:00,Twitter for iPhone,This is Hero. He was enjoying the car ride until he remembered that bees are dying globally at an alarming rate. 11/10 ,"https://twitter.com/dog_rates/status/785170936622350336/photo/1,https://twitter.com/dog_rates/status/785170936622350336/photo/1,https://twitter.com/dog_rates/status/785170936622350336/photo/1,https://twitter.com/dog_rates/status/785170936622350336/photo/1",11,10,Hero,,eskimo_dog,5639,13491
784826020293709826,2016-10-08 18:41:19+00:00,Twitter for iPhone,This is Rusty. He's going D1 for sure. Insane vertical. 13/10 would draft ,https://twitter.com/dog_rates/status/784826020293709826/photo/1,13,10,Rusty,,chow,3712,11310
784517518371221505,2016-10-07 22:15:26+00:00,Twitter for iPhone,This is Frankie. He has yet to learn how to control his tongue. 11/10 maybe one day ,"https://twitter.com/dog_rates/status/784517518371221505/photo/1,https://twitter.com/dog_rates/status/784517518371221505/photo/1,https://twitter.com/dog_rates/status/784517518371221505/photo/1",11,10,Frankie,,malamute,2970,10039
784431430411685888,2016-10-07 16:33:21+00:00,Twitter for iPhone,This is Stormy. He's curly af. Already pupared for Coachella next year. 12/10 ,https://twitter.com/dog_rates/status/784431430411685888/photo/1,12,10,Stormy,,miniature_poodle,1491,6329
783821107061198850,2016-10-06 00:08:09+00:00,Twitter for iPhone,This is Mairi. She has mastered the art of camouflage. 12/10 h*ckin sneaky af ,"https://twitter.com/dog_rates/status/783821107061198850/photo/1,https://twitter.com/dog_rates/status/783821107061198850/photo/1",12,10,Mairi,,lakeland_terrier,2269,8209
783695101801398276,2016-10-05 15:47:27+00:00,Twitter for iPhone,This is Loomis. He's the leader of the Kenneth search party. The passion is almost overwhelming. 12/10 one day he will be free ,"https://twitter.com/dog_rates/status/783695101801398276/photo/1,https://twitter.com/dog_rates/status/783695101801398276/photo/1,https://twitter.com/dog_rates/status/783695101801398276/photo/1",12,10,Loomis,,chow,3737,11650
783466772167098368,2016-10-05 00:40:09+00:00,Twitter for iPhone,This is Finn. He likes eavesdropping from filing cabinets. It's a real issue but no one has approached him about it. 11/10 would still pet ,"https://twitter.com/dog_rates/status/783466772167098368/photo/1,https://twitter.com/dog_rates/status/783466772167098368/photo/1",11,10,Finn,,chihuahua,2608,9468
783391753726550016,2016-10-04 19:42:03+00:00,Twitter for iPhone,Meet Godi. He's an avid beachgoer and part time rainbow summoner. Eyeliner flawless af. 13/10 would snug well ,"https://twitter.com/dog_rates/status/783391753726550016/photo/1,https://twitter.com/dog_rates/status/783391753726550016/photo/1,https://twitter.com/dog_rates/status/783391753726550016/photo/1,https://twitter.com/dog_rates/status/783391753726550016/photo/1",13,10,Godi,,norwegian_elkhound,6441,18908
783334639985389568,2016-10-04 15:55:06+00:00,Twitter for iPhone,This is Dave. He's currently in a predicament. Doesn't seem to mind tho. 12/10 someone assist Dave ,"https://twitter.com/dog_rates/status/783334639985389568/photo/1,https://twitter.com/dog_rates/status/783334639985389568/photo/1,https://twitter.com/dog_rates/status/783334639985389568/photo/1",12,10,Dave,,cardigan,13616,32651
783085703974514689,2016-10-03 23:25:55+00:00,Twitter for iPhone,This is Earl. He can't catch. Did his best tho. 11/10 would repair confidence with extra pats ,"https://twitter.com/dog_rates/status/783085703974514689/photo/1,https://twitter.com/dog_rates/status/783085703974514689/photo/1",11,10,Earl,,chesapeake_bay_retriever,2565,9112
