tweet_id,timestamp,source,text,expanded_urls,rating_numerator,rating_denominator,name,dog_stage,dog_breed_p,retweet_count,favorite_count
718234618122661888,2016-04-08 00:30:51+00:00,Twitter for iPhone,This is Suki. She was born with a blurry tail (unfortunate). Next level tongue tho. 11/10 nifty hardwood ,https://twitter.com/dog_rates/status/718234618122661888/photo/1,11,10,Suki,,malamute,1127,4217
717841801130979328,2016-04-06 22:29:56+00:00,Twitter for iPhone,This is Barclay. His father was a banana. 11/10 appeeling af ,https://twitter.com/dog_rates/status/717841801130979328/photo/1,11,10,Barclay,,brittany_spaniel,670,2660
717537687239008257,2016-04-06 02:21:30+00:00,Twitter for iPhone,People please. This is a Deadly Mediterranean Plop T-Rex. We only rate dogs. Only send in dogs. Thanks you... 11/10 ,https://twitter.com/dog_rates/status/717537687239008257/photo/1,11,10,a,,golden_retriever,2069,6281
717421804990701568,2016-04-05 18:41:02+00:00,Twitter for iPhone,This is Ebby. She's a Zimbabwean Feta. Embarrassed by ridiculously squishy face. 9/10 would squeeze softly ,"https://twitter.com/dog_rates/status/717421804990701568/photo/1,https://twitter.com/dog_rates/status/717421804990701568/photo/1",9,10,Ebby,,miniature_pinscher,945,3446
717047459982213120,2016-04-04 17:53:31+00:00,Twitter for iPhone,This is FlÃ¡vio (pronounced Baxter). He's a Benesnoop Cumberdog. Super rare. Symmetrical. 12/10 would pet so well ,https://twitter.com/dog_rates/status/717047459982213120/photo/1,12,10,FlÃ¡vio,,golden_retriever,2135,6826
717009362452090881,2016-04-04 15:22:08+00:00,Twitter for iPhone,This is Smokey. He's having some sort of existential crisis. 10/10 hang in there pupper ,https://twitter.com/dog_rates/status/717009362452090881/photo/1,10,10,Smokey,pupper,siberian_husky,1102,3583
716802964044845056,2016-04-04 01:41:58+00:00,Twitter for iPhone,This is Link. He struggles with couches. 10/10 would assist ,"https://twitter.com/dog_rates/status/716802964044845056/photo/1,https://twitter.com/dog_rates/status/716802964044845056/photo/1",10,10,Link,,malinois,1317,4627
716791146589110272,2016-04-04 00:55:01+00:00,Twitter for iPhone,Meet Jennifur. She's supposed to be navigating. Not even buckled up. Insubordinate &amp; churlish. 11/10 would still pet ,https://twitter.com/dog_rates/status/716791146589110272/photo/1,11,10,Jennifur,,pomeranian,1474,5204
716439118184652801,2016-04-03 01:36:11+00:00,Twitter for iPhone,This is Bluebert. He just saw that both #FinalFur match ups are split 50/50. Amazed af. 11/10 ,https://twitter.com/dog_rates/status/716439118184652801/photo/1,11,10,Bluebert,,siberian_husky,247,2574
716285507865542656,2016-04-02 15:25:47+00:00,Twitter for iPhone,This is Stephanus. She stays woke. 12/10 ,"https://twitter.com/dog_rates/status/716285507865542656/photo/1,https://twitter.com/dog_rates/status/716285507865542656/photo/1",12,10,Stephanus,,yorkshire_terrier,1225,3041
716080869887381504,2016-04-02 01:52:38+00:00,Twitter for iPhone,Here's a super majestic doggo and a sunset 11/10 ,"https://twitter.com/dog_rates/status/716080869887381504/photo/1,https://twitter.com/dog_rates/status/716080869887381504/photo/1",11,10,None,doggo,golden_retriever,1935,5272
715928423106027520,2016-04-01 15:46:52+00:00,Twitter for iPhone,This is Bubbles. He's a Yorkshire Piccolope. 11/10 would snug aggressively ,https://twitter.com/dog_rates/status/715928423106027520/photo/1,11,10,Bubbles,,pug,987,3485
715733265223708672,2016-04-01 02:51:22+00:00,Twitter for iPhone,This is a taco. We only rate dogs. Please only send in dogs. Dogs are what we rate. Not tacos. Thank you... 10/10 ,https://twitter.com/dog_rates/status/715733265223708672/photo/1,10,10,a,,dandie_dinmont,1920,5093
715696743237730304,2016-04-01 00:26:15+00:00,Twitter for iPhone,Meet Toby. He's a Lithuanian High-Steppin Stickeroo. One of the more accomplished Stickeroos around. 10/10 so nifty ,https://twitter.com/dog_rates/status/715696743237730304/photo/1,10,10,Toby,,staffordshire_bullterrier,1454,4257
715680795826982913,2016-03-31 23:22:53+00:00,Twitter for iPhone,This is Zeus. He's downright fabulous. 12/10 ,"https://twitter.com/dog_rates/status/715680795826982913/photo/1,https://twitter.com/dog_rates/status/715680795826982913/photo/1,https://twitter.com/dog_rates/status/715680795826982913/photo/1",12,10,Zeus,,golden_retriever,1813,4719
715342466308784130,2016-03-31 00:58:29+00:00,Twitter for iPhone,This is Oscar. He's a world renowned snowball inspector. It's a ruff job but someone has to do it. 10/10 great guy ,"https://twitter.com/dog_rates/status/715342466308784130/photo/1,https://twitter.com/dog_rates/status/715342466308784130/photo/1",10,10,Oscar,,west_highland_white_terrier,768,3294
715220193576927233,2016-03-30 16:52:36+00:00,Twitter for iPhone,This is Nico. His selfie game is strong af. Excellent use of a sneaky tongue slip. 10/10 star material ,https://twitter.com/dog_rates/status/715220193576927233/photo/1,10,10,Nico,,chihuahua,736,2630
715200624753819648,2016-03-30 15:34:51+00:00,Twitter for iPhone,This is Michelangelope. He's half coffee cup. Rare af. 12/10 would hug until someone stopped me ,https://twitter.com/dog_rates/status/715200624753819648/photo/1,12,10,Michelangelope,,chihuahua,2110,5578
715009755312439296,2016-03-30 02:56:24+00:00,Twitter for iPhone,This is Siba. She's remarkably mobile. Very sleepy as well. 12/10 would happily transport ,https://twitter.com/dog_rates/status/715009755312439296/photo/1,12,10,Siba,,chihuahua,1392,4550
714982300363173890,2016-03-30 01:07:18+00:00,Twitter for iPhone,This is Calbert. He forgot to clear his Google search history. 9/10 rookie mistake Calbert ,https://twitter.com/dog_rates/status/714982300363173890/photo/1,9,10,Calbert,,brittany_spaniel,1166,4094
714957620017307648,2016-03-29 23:29:14+00:00,Twitter for iPhone,This is Curtis. He's an Albino Haberdasher. Terrified of dandelions. They really spook him up. 10/10 it'll be ok pup ,https://twitter.com/dog_rates/status/714957620017307648/photo/1,10,10,Curtis,,great_pyrenees,1595,4503
714606013974974464,2016-03-29 00:12:05+00:00,Twitter for iPhone,Here are two lil cuddly puppers. Both 12/10 would snug like so much ,https://twitter.com/dog_rates/status/714606013974974464/photo/1,12,10,None,,norfolk_terrier,1038,3938
714258258790387713,2016-03-28 01:10:13+00:00,Twitter for iPhone,"Meet Travis and Flurp. Travis is pretty chill but Flurp can't lie down properly. 10/10 &amp; 8/10
get it together Flurp ",https://twitter.com/dog_rates/status/714258258790387713/photo/1,10,10,Travis,,collie,808,3281
714251586676113411,2016-03-28 00:43:43+00:00,Twitter for iPhone,This is Thumas. He hates potted plants. 8/10 wtf Thumas ,"https://twitter.com/dog_rates/status/714251586676113411/photo/1,https://twitter.com/dog_rates/status/714251586676113411/photo/1",8,10,Thumas,,soft-coated_wheaten_terrier,940,3570
714214115368108032,2016-03-27 22:14:49+00:00,Twitter for iPhone,Happy Easter from the squad! ðŸ‡ðŸ¶ 13/10 for all ,https://twitter.com/dog_rates/status/714214115368108032/photo/1,13,10,None,,pug,990,2480
714141408463036416,2016-03-27 17:25:54+00:00,Twitter for iPhone,"I know we only rate dogs, but since it's Easter I guess we could rate a bunny for a change. 10/10 petable as hell ",https://twitter.com/dog_rates/status/714141408463036416/photo/1,10,10,None,,labrador_retriever,1569,4673
713919462244790272,2016-03-27 02:43:58+00:00,Twitter for iPhone,This is Kanu. He's a Freckled Ticonderoga. Simply flawless. 12/10 would perform an elaborate heist to capture ,https://twitter.com/dog_rates/status/713919462244790272/photo/1,12,10,Kanu,,siberian_husky,869,3564
713900603437621249,2016-03-27 01:29:02+00:00,Twitter for iPhone,Happy Saturday here's 9 puppers on a bench. 99/90 good work everybody ,https://twitter.com/dog_rates/status/713900603437621249/photo/1,99,90,None,,golden_retriever,829,3062
713761197720473600,2016-03-26 16:15:05+00:00,Twitter for iPhone,This is Piper. She would really like that tennis ball core. Super sneaky tongue slip. 12/10 precious af ,"https://twitter.com/dog_rates/status/713761197720473600/photo/1,https://twitter.com/dog_rates/status/713761197720473600/photo/1",12,10,Piper,,brittany_spaniel,1541,5308
713411074226274305,2016-03-25 17:03:49+00:00,Twitter for iPhone,Here we see an extremely rare Bearded Floofmallow. Only a few left in the wild. 11/10 would pet with a purpose ,https://twitter.com/dog_rates/status/713411074226274305/photo/1,11,10,None,,great_pyrenees,1440,4802
713177543487135744,2016-03-25 01:35:51+00:00,Twitter for iPhone,This is Lance. Lance doesn't give a shit. 10/10 we should all be more like Lance ,https://twitter.com/dog_rates/status/713177543487135744/photo/1,10,10,Lance,,whippet,3183,7854
713175907180089344,2016-03-25 01:29:21+00:00,Twitter for iPhone,Say hello to Opie and Clarkus. Clarkus fell asleep so Opie buried him. Ruthless af 10/10 for both ,https://twitter.com/dog_rates/status/713175907180089344/photo/1,10,10,Opie,,malamute,1630,4851
712809025985978368,2016-03-24 01:11:29+00:00,Twitter for iPhone,This is Stubert. He just arrived. 10/10 ,https://twitter.com/dog_rates/status/712809025985978368/photo/1,10,10,Stubert,,labrador_retriever,7602,20378
712717840512598017,2016-03-23 19:09:09+00:00,Twitter for iPhone,Please don't send in any more polar bears. We only rate dogs. Thank you... 10/10 ,https://twitter.com/dog_rates/status/712717840512598017/photo/1,10,10,None,,great_pyrenees,5616,13474
712668654853337088,2016-03-23 15:53:42+00:00,Twitter for iPhone,Say hello to Sunny and Roxy. They pull things out of water together. 10/10 for both ,"https://twitter.com/dog_rates/status/712668654853337088/photo/1,https://twitter.com/dog_rates/status/712668654853337088/photo/1,https://twitter.com/dog_rates/status/712668654853337088/photo/1",10,10,Sunny,,labrador_retriever,1367,4531
712438159032893441,2016-03-23 00:37:48+00:00,Twitter for iPhone,This is Kane. He's a semi-submerged Haitian Huffleplop. Happy af. Sick waterfall. 11/10 would pat head approvingly ,https://twitter.com/dog_rates/status/712438159032893441/photo/1,11,10,Kane,,great_pyrenees,1756,5799
712097430750289920,2016-03-22 02:03:52+00:00,Twitter for iPhone,I can't even comprehend how confused this dog must be right now. 10/10 ,https://twitter.com/dog_rates/status/712097430750289920/photo/1,10,10,None,,labrador_retriever,1172,4144
712085617388212225,2016-03-22 01:16:55+00:00,Twitter for iPhone,"Say hello to Olive and Ruby. They are best buddies. Both 11/10 
1 like = 1 buddy ","https://twitter.com/dog_rates/status/712085617388212225/photo/1,https://twitter.com/dog_rates/status/712085617388212225/photo/1,https://twitter.com/dog_rates/status/712085617388212225/photo/1",11,10,Olive,,shih-tzu,556,3531
711743778164514816,2016-03-21 02:38:34+00:00,Twitter for iPhone,Meet Roosevelt. He's calculating the best case scenario if he drops out instead of doing math hw. 11/10 relatable af ,https://twitter.com/dog_rates/status/711743778164514816/photo/1,11,10,Roosevelt,,lakeland_terrier,1101,3095
711732680602345472,2016-03-21 01:54:29+00:00,Twitter for iPhone,I want to hear the joke this dog was just told. 10/10 ,"https://twitter.com/dog_rates/status/711732680602345472/photo/1,https://twitter.com/dog_rates/status/711732680602345472/photo/1,https://twitter.com/dog_rates/status/711732680602345472/photo/1",10,10,None,,ibizan_hound,4653,9756
711363825979756544,2016-03-20 01:28:47+00:00,Twitter for iPhone,"""Please, no puparazzi"" 11/10 ","https://twitter.com/dog_rates/status/711363825979756544/photo/1,https://twitter.com/dog_rates/status/711363825979756544/photo/1",11,10,None,,pembroke,1287,3996
711306686208872448,2016-03-19 21:41:44+00:00,Twitter for iPhone,What hooligan sent in pictures w/out a dog in them? Churlish af. 3/10 just bc that's a neat fluffy bean bag chair ,"https://twitter.com/dog_rates/status/711306686208872448/photo/1,https://twitter.com/dog_rates/status/711306686208872448/photo/1",3,10,None,,dandie_dinmont,819,3596
711008018775851008,2016-03-19 01:54:56+00:00,Twitter for iPhone,This is Chuckles. He had a balloon but he accidentally let go of it and it floated away. 11/10 hang in there pupper ,https://twitter.com/dog_rates/status/711008018775851008/photo/1,11,10,Chuckles,pupper,french_bulldog,710,3275
710997087345876993,2016-03-19 01:11:29+00:00,Twitter for iPhone,Meet Milo and Amos. They are the best of pals. Both 12/10 would pet at the same time ,https://twitter.com/dog_rates/status/710997087345876993/photo/1,12,10,Milo,,malamute,1561,4960
710844581445812225,2016-03-18 15:05:29+00:00,Twitter for iPhone,This is Staniel. His selfie game is strong af. 10/10 I'd snapchat with Staniel ,https://twitter.com/dog_rates/status/710844581445812225/photo/1,10,10,Staniel,,pembroke,779,2775
710833117892898816,2016-03-18 14:19:56+00:00,Twitter for iPhone,Say hello to Sora. She's an Egyptian Pumpernickel. Mesmerizing af. 12/10 would bring home to mom ,https://twitter.com/dog_rates/status/710833117892898816/photo/1,12,10,Sora,,pembroke,606,2937
710658690886586372,2016-03-18 02:46:49+00:00,Twitter for iPhone,Here's a brigade of puppers. All look very prepared for whatever happens next. 80/80 ,https://twitter.com/dog_rates/status/710658690886586372/photo/1,80,80,None,,soft-coated_wheaten_terrier,636,2529
710588934686908417,2016-03-17 22:09:38+00:00,Twitter for iPhone,This is Beemo. He's a Chubberflop mix. 12/10 would cross the world for ,"https://twitter.com/dog_rates/status/710588934686908417/photo/1,https://twitter.com/dog_rates/status/710588934686908417/photo/1,https://twitter.com/dog_rates/status/710588934686908417/photo/1,https://twitter.com/dog_rates/status/710588934686908417/photo/1",12,10,Beemo,,pembroke,2107,4968
710283270106132480,2016-03-17 01:55:02+00:00,Twitter for iPhone,This is Gunner. He's a Figamus Newton. King of the peek-a-boo. Cool jeans. 11/10 ,"https://twitter.com/dog_rates/status/710283270106132480/photo/1,https://twitter.com/dog_rates/status/710283270106132480/photo/1",11,10,Gunner,,shih-tzu,580,2308
710272297844797440,2016-03-17 01:11:26+00:00,Twitter for iPhone,We ðŸ‘ðŸ» only ðŸ‘ðŸ» rate ðŸ‘ðŸ» dogs. Pls stop sending in non-canines like this Dutch Panda Worm. This is infuriating. 11/10 ,https://twitter.com/dog_rates/status/710272297844797440/photo/1,11,10,infuriating,,old_english_sheepdog,1425,4945
710269109699739648,2016-03-17 00:58:46+00:00,Twitter for iPhone,"The squad is back for St. Patrick's Day! â˜˜ ðŸ’š
13/10 for all ",https://twitter.com/dog_rates/status/710269109699739648/photo/1,13,10,None,,pug,1257,2613
710153181850935296,2016-03-16 17:18:07+00:00,Twitter for iPhone,This is Lacy. She's tipping her hat to you. Daydreams of her life back on the frontier. 11/10 would pet so well ,"https://twitter.com/dog_rates/status/710153181850935296/photo/1,https://twitter.com/dog_rates/status/710153181850935296/photo/1",11,10,Lacy,,cocker_spaniel,1006,3153
710140971284037632,2016-03-16 16:29:35+00:00,Twitter for iPhone,This is Tater. His underbite is fierce af. Doesn't give a damn about your engagement photo. 8/10 ,https://twitter.com/dog_rates/status/710140971284037632/photo/1,8,10,Tater,,pekinese,1008,3017
710117014656950272,2016-03-16 14:54:24+00:00,Twitter for iPhone,This pupper got her hair chalked for her birthday. Hasn't told her parents yet. Rebellious af. 11/10 very nifty ,"https://twitter.com/dog_rates/status/710117014656950272/photo/1,https://twitter.com/dog_rates/status/710117014656950272/photo/1",11,10,None,pupper,toy_poodle,2233,5999
709918798883774466,2016-03-16 01:46:45+00:00,Twitter for iPhone,Meet Watson. He's a Suzuki Tickleboop. Leader of a notorious biker gang. Only one ear functional. 12/10 snuggable af ,"https://twitter.com/dog_rates/status/709918798883774466/photo/1,https://twitter.com/dog_rates/status/709918798883774466/photo/1",12,10,Watson,,pembroke,1215,3250
709852847387627521,2016-03-15 21:24:41+00:00,Twitter for iPhone,*lets out a tiny whimper and then collapses* ...12/10 ,"https://twitter.com/dog_rates/status/709852847387627521/photo/1,https://twitter.com/dog_rates/status/709852847387627521/photo/1,https://twitter.com/dog_rates/status/709852847387627521/photo/1,https://twitter.com/dog_rates/status/709852847387627521/photo/1",12,10,None,,chihuahua,1336,3824
709566166965075968,2016-03-15 02:25:31+00:00,Twitter for iPhone,This is Olaf. He's gotta be rare. Seems sturdy. Tail is floofy af. 12/10 would do whatever it takes to pet ,https://twitter.com/dog_rates/status/709566166965075968/photo/1,12,10,Olaf,,chow,1367,3865
709556954897764353,2016-03-15 01:48:55+00:00,Twitter for iPhone,This is Cecil. She's a Gigglefloof Poofer. Outdoorsy af. One with nature. 12/10 would strategically capture ,"https://twitter.com/dog_rates/status/709556954897764353/photo/1,https://twitter.com/dog_rates/status/709556954897764353/photo/1,https://twitter.com/dog_rates/status/709556954897764353/photo/1",12,10,Cecil,,golden_retriever,1204,3593
709519240576036864,2016-03-14 23:19:03+00:00,Twitter for iPhone,This is Vince. He's a Gregorian Flapjeck. White spot on legs almost looks like another dog (whoa). 9/10 rad as hell ,https://twitter.com/dog_rates/status/709519240576036864/photo/1,9,10,Vince,,cocker_spaniel,277,1620
709449600415961088,2016-03-14 18:42:20+00:00,Twitter for iPhone,Meet Karma. She's just a head. Lost body during the Second Punic War (unfortunate). Loves to travel 10/10 petable af ,"https://twitter.com/dog_rates/status/709449600415961088/photo/1,https://twitter.com/dog_rates/status/709449600415961088/photo/1",10,10,Karma,,maltese_dog,665,2420
709409458133323776,2016-03-14 16:02:49+00:00,Twitter for iPhone,This is Billy. He sensed a squirrel. 8/10 damn it Billy ,https://twitter.com/dog_rates/status/709409458133323776/photo/1,8,10,Billy,,shetland_sheepdog,788,2855
709225125749587968,2016-03-14 03:50:21+00:00,Twitter for iPhone,This is Walker. He's a Butternut Khalifa. Appears fuzzy af. 11/10 would hug for a ridiculous amount of time ,https://twitter.com/dog_rates/status/709225125749587968/photo/1,11,10,Walker,,labrador_retriever,647,2615
709207347839836162,2016-03-14 02:39:42+00:00,Twitter for iPhone,This is Penny. She's trying on her prom dress. Stunning af 11/10 ,https://twitter.com/dog_rates/status/709207347839836162/photo/1,11,10,Penny,,chihuahua,6567,13755
709198395643068416,2016-03-14 02:04:08+00:00,Twitter for iPhone,"From left to right:
Cletus, Jerome, Alejandro, Burp, &amp; Titson
None know where camera is. 45/50 would hug all at once ",https://twitter.com/dog_rates/status/709198395643068416/photo/1,45,50,None,,borzoi,721,2634
709158332880297985,2016-03-13 23:24:56+00:00,Twitter for iPhone,Meet Rodney. He's a Ukranian Boomchicka. Outside but would like to be inside. Only has one ear (unfortunate) 10/10 ,https://twitter.com/dog_rates/status/709158332880297985/photo/1,10,10,Rodney,,siberian_husky,470,2236
709042156699303936,2016-03-13 15:43:18+00:00,Twitter for iPhone,This is Klevin. He's addicted to sandwiches (yes a hotdog is a sandwich fight me) It's tearing his family apart 9/10 ,https://twitter.com/dog_rates/status/709042156699303936/photo/1,9,10,Klevin,,rottweiler,1864,5197
708845821941387268,2016-03-13 02:43:08+00:00,Twitter for iPhone,Here's a pupper with magic eyes. Not wearing a seat belt tho (irresponsible af). Very distracting to driver. 9/10 ,"https://twitter.com/dog_rates/status/708845821941387268/photo/1,https://twitter.com/dog_rates/status/708845821941387268/photo/1",9,10,None,pupper,schipperke,1015,3226
708834316713893888,2016-03-13 01:57:25+00:00,Twitter for iPhone,Meet Malikai. He was rolling around having fun when he remembered the inevitable heat death of the universe. 10/10 ,https://twitter.com/dog_rates/status/708834316713893888/photo/1,10,10,Malikai,,eskimo_dog,571,1860
708810915978854401,2016-03-13 00:24:26+00:00,Twitter for iPhone,This is Mister. He's a wonderful father to his two pups. Heartwarming af. 10/10 for all ,"https://twitter.com/dog_rates/status/708810915978854401/photo/1,https://twitter.com/dog_rates/status/708810915978854401/photo/1,https://twitter.com/dog_rates/status/708810915978854401/photo/1",10,10,Mister,,golden_retriever,7848,18036
708738143638450176,2016-03-12 19:35:15+00:00,Twitter for iPhone,This is Coco. She gets to stay on the Bachelor for another week. Super pumped 11/10 ,https://twitter.com/dog_rates/status/708738143638450176/photo/1,11,10,Coco,,pomeranian,917,2997
708711088997666817,2016-03-12 17:47:45+00:00,Twitter for iPhone,This is Smokey. He really likes tennis balls. 11/10 ,"https://twitter.com/dog_rates/status/708711088997666817/photo/1,https://twitter.com/dog_rates/status/708711088997666817/photo/1",11,10,Smokey,,german_short-haired_pointer,834,2790
708479650088034305,2016-03-12 02:28:06+00:00,Twitter for iPhone,Meet Bear. He's a Beneboop Cumberclap. Extremely unamused. 13/10 I'm in love with this picture ,https://twitter.com/dog_rates/status/708479650088034305/photo/1,13,10,Bear,,shih-tzu,765,2768
708469915515297792,2016-03-12 01:49:25+00:00,Twitter for iPhone,This is Bobble. He's a Croatian Galifianakis. Hears everything within 400 miles. 11/10 would snug diligently ,https://twitter.com/dog_rates/status/708469915515297792/photo/1,11,10,Bobble,,chihuahua,926,3357
708356463048204288,2016-03-11 18:18:36+00:00,Twitter for iPhone,This is Oliver. That is his castle. He protects it with his life. He's also squishy af. 10/10 would squish softly ,"https://twitter.com/dog_rates/status/708356463048204288/photo/1,https://twitter.com/dog_rates/status/708356463048204288/photo/1",10,10,Oliver,,pug,1520,3929
708349470027751425,2016-03-11 17:50:48+00:00,Twitter for iPhone,This is River. He's changing the trumpet game. Innovative af. 11/10 such a good boy ,https://twitter.com/dog_rates/status/708349470027751425/photo/1,11,10,River,,basenji,831,2568
708149363256774660,2016-03-11 04:35:39+00:00,Twitter for iPhone,This is Jebberson. He's the reigning hide and seek world champion. 10/10 hasn't lost his touch ,https://twitter.com/dog_rates/status/708149363256774660/photo/1,10,10,Jebberson,,cardigan,1727,4672
708130923141795840,2016-03-11 03:22:23+00:00,Twitter for iPhone,Please stop sending in non canines like this Guatemalan Twiggle Bunny. We only rate dogs. Only send in dogs... 11/10 ,https://twitter.com/dog_rates/status/708130923141795840/photo/1,11,10,None,,french_bulldog,943,3707
708119489313951744,2016-03-11 02:36:57+00:00,Twitter for iPhone,This is Cooper. He basks in the glory of rebellion. 9/10 probably a preteen ,https://twitter.com/dog_rates/status/708119489313951744/photo/1,9,10,Cooper,,norwich_terrier,1102,2937
708109389455101952,2016-03-11 01:56:49+00:00,Twitter for iPhone,This is Remington. He was caught off guard by the magical floating cheese. Spooked af. 10/10 deep breaths pup ,https://twitter.com/dog_rates/status/708109389455101952/photo/1,10,10,Remington,,staffordshire_bullterrier,610,2124
708026248782585858,2016-03-10 20:26:26+00:00,Twitter for iPhone,Everybody stop what you're doing and watch this video. Frank is stuck in a loop. 13/10 (Vid by @klbmatty) ,https://twitter.com/dog_rates/status/708026248782585858/video/1,13,10,None,,malinois,2166,4799
707969809498152960,2016-03-10 16:42:10+00:00,Twitter for iPhone,Meet Rufus. He's a Honeysuckle Firefox. Curly af. Badass tie. About to go on his first date ever 11/10 good luck pup ,https://twitter.com/dog_rates/status/707969809498152960/photo/1,11,10,Rufus,,toy_poodle,1097,2941
707776935007539200,2016-03-10 03:55:45+00:00,Twitter for iPhone,This is Sadie. She's a Bohemian Rhapsody. Remarkably portable. Could sneak on roller coasters with (probably). 11/10 ,https://twitter.com/dog_rates/status/707776935007539200/photo/1,11,10,Sadie,,miniature_pinscher,1079,3593
707741517457260545,2016-03-10 01:35:01+00:00,Twitter for iPhone,When your roommate eats your leftover Chili's but you pretend it's no big deal cuz you fat anyway. 10/10 head up pup ,https://twitter.com/dog_rates/status/707741517457260545/photo/1,10,10,None,,whippet,696,2718
707610948723478529,2016-03-09 16:56:11+00:00,Twitter for iPhone,This is Harper. She scraped her elbow attempting a backflip off a tree. Valiant effort tho. 12/10 ,https://twitter.com/dog_rates/status/707610948723478529/photo/1,12,10,Harper,,golden_retriever,7236,18557
707420581654872064,2016-03-09 04:19:44+00:00,Twitter for iPhone,This is Keurig. He's a rare dog. Laughs like an idiot tho. Head is basically a weapon. Poorly maintained goatee 4/10 ,https://twitter.com/dog_rates/status/707420581654872064/photo/1,4,10,Keurig,,kuvasz,789,2499
707411934438625280,2016-03-09 03:45:22+00:00,Twitter for iPhone,"""I shall trip the big pupper with leash. Big pupper will never see it coming. I am a genius."" Both 11/10 ",https://twitter.com/dog_rates/status/707411934438625280/photo/1,11,10,None,pupper,lakeland_terrier,673,2486
707387676719185920,2016-03-09 02:08:59+00:00,Twitter for iPhone,Meet Clarkus. He's a Skinny Eastern Worcestershire. Can tie own shoes (impressive af) 10/10 would put on track team ,https://twitter.com/dog_rates/status/707387676719185920/photo/1,10,10,Clarkus,,chihuahua,1490,3835
707377100785885184,2016-03-09 01:26:57+00:00,Twitter for iPhone,This dog just brutally murdered a snowman. Currently toying with its nutritious remains 9/10 would totally still pet ,"https://twitter.com/dog_rates/status/707377100785885184/photo/1,https://twitter.com/dog_rates/status/707377100785885184/photo/1",9,10,None,,golden_retriever,1214,3603
707315916783140866,2016-03-08 21:23:50+00:00,Twitter for iPhone,This is Finnegus. He's trapped in a snow globe. Poor pupper. 10/10 would make sure no one shook it ,"https://twitter.com/dog_rates/status/707315916783140866/photo/1,https://twitter.com/dog_rates/status/707315916783140866/photo/1",10,10,Finnegus,pupper,bernese_mountain_dog,727,2698
