tweet_id,timestamp,source,text,expanded_urls,rating_numerator,rating_denominator,name,dog_stage,dog_breed_p,retweet_count,favorite_count
892177421306343426,2017-08-01 00:17:27+00:00,Twitter for iPhone,"This is Tilly. She's just checking pup on you. Hopes you're doing ok. If not, she's available for pats, snugs, boops, the whole bit. 13/10 ",https://twitter.com/dog_rates/status/892177421306343426/photo/1,13,10,Tilly,,chihuahua,6514,33819
891815181378084864,2017-07-31 00:18:03+00:00,Twitter for iPhone,This is Archie. He is a rare Norwegian Pouncing Corgo. Lives in the tall grass. You never know when one may strike. 12/10 ,https://twitter.com/dog_rates/status/891815181378084864/photo/1,12,10,Archie,,chihuahua,4328,25461
891689557279858688,2017-07-30 15:58:51+00:00,Twitter for iPhone,This is Darla. She commenced a snooze mid meal. 13/10 happens to the best of us ,https://twitter.com/dog_rates/status/891689557279858688/photo/1,13,10,Darla,,labrador_retriever,8964,42908
891327558926688256,2017-07-29 16:00:24+00:00,Twitter for iPhone,"This is Franklin. He would like you to stop calling him ""cute."" He is a very fierce shark and should be respected as such. 12/10 #BarkWeek ","https://twitter.com/dog_rates/status/891327558926688256/photo/1,https://twitter.com/dog_rates/status/891327558926688256/photo/1",12,10,Franklin,,basset,9774,41048
891087950875897856,2017-07-29 00:08:17+00:00,Twitter for iPhone,Here we have a majestic great white breaching off South Africa's coast. Absolutely h*ckin breathtaking. 13/10 (IG: tucker_marlo) #BarkWeek ,https://twitter.com/dog_rates/status/891087950875897856/photo/1,13,10,None,,chesapeake_bay_retriever,3261,20562
890971913173991426,2017-07-28 16:27:12+00:00,Twitter for iPhone,"Meet Jax. He enjoys ice cream so much he gets nervous around it. 13/10 help Jax enjoy more things by clicking below

 ","https://gofundme.com/ydvmve-surgery-for-jax,https://twitter.com/dog_rates/status/890971913173991426/photo/1",13,10,Jax,,appenzeller,2158,12041
890729181411237888,2017-07-28 00:22:40+00:00,Twitter for iPhone,When you watch your owner call another dog a good boy but then they turn back to you and say you're a great boy. 13/10 ,"https://twitter.com/dog_rates/status/890729181411237888/photo/1,https://twitter.com/dog_rates/status/890729181411237888/photo/1",13,10,None,,pomeranian,16716,56848
890609185150312448,2017-07-27 16:25:51+00:00,Twitter for iPhone,This is Zoey. She doesn't want to be one of the scary sharks. Just wants to be a snuggly pettable boatpet. 13/10 #BarkWeek ,https://twitter.com/dog_rates/status/890609185150312448/photo/1,13,10,Zoey,,irish_terrier,4429,28226
890240255349198849,2017-07-26 15:59:51+00:00,Twitter for iPhone,This is Cassie. She is a college pup. Studying international doggo communication and stick theory. 14/10 so elegant much sophisticate ,https://twitter.com/dog_rates/status/890240255349198849/photo/1,14,10,Cassie,doggo,pembroke,7711,32467
890006608113172480,2017-07-26 00:31:25+00:00,Twitter for iPhone,This is Koda. He is a South Australian deckshark. Deceptively deadly. Frighteningly majestic. 13/10 would risk a petting #BarkWeek ,"https://twitter.com/dog_rates/status/890006608113172480/photo/1,https://twitter.com/dog_rates/status/890006608113172480/photo/1",13,10,Koda,,samoyed,7624,31166
889880896479866881,2017-07-25 16:11:53+00:00,Twitter for iPhone,This is Bruno. He is a service shark. Only gets out of the water to assist you. 13/10 terrifyingly good boy ,https://twitter.com/dog_rates/status/889880896479866881/photo/1,13,10,Bruno,,french_bulldog,5156,28268
889665388333682689,2017-07-25 01:55:32+00:00,Twitter for iPhone,Here's a puppo that seems to be on the fence about something haha no but seriously someone help her. 13/10 ,https://twitter.com/dog_rates/status/889665388333682689/photo/1,13,10,None,puppo,pembroke,8538,38818
889638837579907072,2017-07-25 00:10:02+00:00,Twitter for iPhone,This is Ted. He does his best. Sometimes that's not enough. But it's ok. 12/10 would assist ,"https://twitter.com/dog_rates/status/889638837579907072/photo/1,https://twitter.com/dog_rates/status/889638837579907072/photo/1",12,10,Ted,,french_bulldog,4735,27672
889531135344209921,2017-07-24 17:02:04+00:00,Twitter for iPhone,This is Stuart. He's sporting his favorite fanny pack. Secretly filled with bones only. 13/10 puppared puppo #BarkWeek ,https://twitter.com/dog_rates/status/889531135344209921/photo/1,13,10,Stuart,puppo,golden_retriever,2321,15359
889278841981685760,2017-07-24 00:19:32+00:00,Twitter for iPhone,This is Oliver. You're witnessing one of his many brutal attacks. Seems to be playing with his victim. 13/10 fr*ckin frightening #BarkWeek ,https://twitter.com/dog_rates/status/889278841981685760/video/1,13,10,Oliver,,whippet,5637,25652
888917238123831296,2017-07-23 00:22:39+00:00,Twitter for iPhone,This is Jim. He found a fren. Taught him how to sit like the good boys. 12/10 for both ,https://twitter.com/dog_rates/status/888917238123831296/photo/1,12,10,Jim,,golden_retriever,4709,29611
888804989199671297,2017-07-22 16:56:37+00:00,Twitter for iPhone,This is Zeke. He has a new stick. Very proud of it. Would like you to throw it for him without taking it. 13/10 would do my best ,"https://twitter.com/dog_rates/status/888804989199671297/photo/1,https://twitter.com/dog_rates/status/888804989199671297/photo/1",13,10,Zeke,,golden_retriever,4559,26080
888554962724278272,2017-07-22 00:23:06+00:00,Twitter for iPhone,This is Ralphus. He's powering up. Attempting maximum borkdrive. 13/10 inspirational af ,"https://twitter.com/dog_rates/status/888554962724278272/photo/1,https://twitter.com/dog_rates/status/888554962724278272/photo/1,https://twitter.com/dog_rates/status/888554962724278272/photo/1,https://twitter.com/dog_rates/status/888554962724278272/photo/1",13,10,Ralphus,,siberian_husky,3732,20290
888078434458587136,2017-07-20 16:49:33+00:00,Twitter for iPhone,This is Gerald. He was just told he didn't get the job he interviewed for. A h*ckin injustice. 12/10 didn't want the job anyway ,"https://twitter.com/dog_rates/status/888078434458587136/photo/1,https://twitter.com/dog_rates/status/888078434458587136/photo/1",12,10,Gerald,,french_bulldog,3653,22201
887705289381826560,2017-07-19 16:06:48+00:00,Twitter for iPhone,This is Jeffrey. He has a monopoly on the pool noodles. Currently running a 'boop for two' midweek sale. 13/10 h*ckin strategic ,https://twitter.com/dog_rates/status/887705289381826560/photo/1,13,10,Jeffrey,,basset,5609,30779
887473957103951883,2017-07-19 00:47:34+00:00,Twitter for iPhone,This is Canela. She attempted some fancy porch pics. They were unsuccessful. 13/10 someone help her ,"https://twitter.com/dog_rates/status/887473957103951883/photo/1,https://twitter.com/dog_rates/status/887473957103951883/photo/1",13,10,Canela,,pembroke,18781,69871
887343217045368832,2017-07-18 16:08:03+00:00,Twitter for iPhone,You may not have known you needed to see this today. 13/10 please enjoy (IG: emmylouroo) ,https://twitter.com/dog_rates/status/887343217045368832/video/1,13,10,None,,mexican_hairless,10737,34222
887101392804085760,2017-07-18 00:07:08+00:00,Twitter for iPhone,This... is a Jubilant Antarctic House Bear. We only rate dogs. Please only send dogs. Thank you... 12/10 would suffocate in floof ,https://twitter.com/dog_rates/status/887101392804085760/photo/1,12,10,None,,samoyed,6167,31061
886983233522544640,2017-07-17 16:17:36+00:00,Twitter for iPhone,This is Maya. She's very shy. Rarely leaves her cup. 13/10 would find her an environment to thrive in ,"https://twitter.com/dog_rates/status/886983233522544640/photo/1,https://twitter.com/dog_rates/status/886983233522544640/photo/1",13,10,Maya,,chihuahua,8084,35859
886736880519319552,2017-07-16 23:58:41+00:00,Twitter for iPhone,"This is Mingus. He's a wonderful father to his smol pup. Confirmed 13/10, but he needs your help

 ","https://www.gofundme.com/mingusneedsus,https://twitter.com/dog_rates/status/886736880519319552/photo/1,https://twitter.com/dog_rates/status/886736880519319552/photo/1",13,10,Mingus,,kuvasz,3443,12306
886366144734445568,2017-07-15 23:25:31+00:00,Twitter for iPhone,This is Roscoe. Another pupper fallen victim to spontaneous tongue ejections. Get the BlepiPen immediate. 12/10 deep breaths Roscoe ,"https://twitter.com/dog_rates/status/886366144734445568/photo/1,https://twitter.com/dog_rates/status/886366144734445568/photo/1",12,10,Roscoe,pupper,french_bulldog,3316,21524
886258384151887873,2017-07-15 16:17:19+00:00,Twitter for iPhone,This is Waffles. His doggles are pupside down. Unsure how to fix. 13/10 someone assist Waffles ,https://twitter.com/dog_rates/status/886258384151887873/photo/1,13,10,Waffles,,pug,6523,28469
885984800019947520,2017-07-14 22:10:11+00:00,Twitter for iPhone,Viewer discretion advised. This is Jimbo. He will rip ur finger right h*ckin off. Other dog clearly an accessory. 12/10 pls pet with caution ,https://twitter.com/dog_rates/status/885984800019947520/photo/1,12,10,Jimbo,,blenheim_spaniel,7097,33382
885528943205470208,2017-07-13 15:58:47+00:00,Twitter for iPhone,This is Maisey. She fell asleep mid-excavation. Happens to the best of us. 13/10 would pat noggin approvingly ,https://twitter.com/dog_rates/status/885528943205470208/photo/1,13,10,Maisey,,pug,6683,36689
885167619883638784,2017-07-12 16:03:00+00:00,Twitter for iPhone,Here we have a corgi undercover as a malamute. Pawbably doing important investigative work. Zero control over tongue happenings. 13/10 ,"https://twitter.com/dog_rates/status/885167619883638784/photo/1,https://twitter.com/dog_rates/status/885167619883638784/photo/1,https://twitter.com/dog_rates/status/885167619883638784/photo/1,https://twitter.com/dog_rates/status/885167619883638784/photo/1",13,10,None,,malamute,4556,22367
884925521741709313,2017-07-12 00:01:00+00:00,Twitter for iPhone,"This is Earl. He found a hat. Nervous about what you think of it. 12/10 it's delightful, Earl ",https://twitter.com/dog_rates/status/884925521741709313/photo/1,12,10,Earl,,italian_greyhound,16439,68152
884876753390489601,2017-07-11 20:47:12+00:00,Twitter for iPhone,This is Lola. It's her first time outside. Must test the earth and taste the atmosphere. 13/10 you're doing great Lola ,"https://twitter.com/dog_rates/status/884876753390489601/photo/1,https://twitter.com/dog_rates/status/884876753390489601/photo/1,https://twitter.com/dog_rates/status/884876753390489601/photo/1,https://twitter.com/dog_rates/status/884876753390489601/photo/1",13,10,Lola,,chow,6096,28514
884562892145688576,2017-07-11 00:00:02+00:00,Twitter for iPhone,This is Kevin. He's just so happy. 13/10 what is your secret Kevin ,https://twitter.com/dog_rates/status/884562892145688576/photo/1,13,10,Kevin,,pug,5100,24765
884441805382717440,2017-07-10 15:58:53+00:00,Twitter for iPhone,"I present to you, Pup in Hat. Pup in Hat is great for all occasions. Extremely versatile. Compact as h*ck. 14/10 (IG: itselizabethgales) ",https://twitter.com/dog_rates/status/884441805382717440/photo/1,14,10,None,,pembroke,5856,27478
884162670584377345,2017-07-09 21:29:42+00:00,Twitter for iPhone,Meet Yogi. He doesn't have any important dog meetings today he just enjoys looking his best at all times. 12/10 for dangerously dapper doggo ,https://twitter.com/dog_rates/status/884162670584377345/photo/1,12,10,Yogi,doggo,german_shepherd,3128,20771
883838122936631299,2017-07-09 00:00:04+00:00,Twitter for iPhone,This is Noah. He can't believe someone made this mess. Got the vacuum out for you though. Offered to help clean pup. 12/10 super good boy ,https://twitter.com/dog_rates/status/883838122936631299/photo/1,12,10,Noah,,doberman,3586,22349
883482846933004288,2017-07-08 00:28:19+00:00,Twitter for iPhone,"This is Bella. She hopes her smile made you smile. If not, she is also offering you her favorite monkey. 13.5/10 ","https://twitter.com/dog_rates/status/883482846933004288/photo/1,https://twitter.com/dog_rates/status/883482846933004288/photo/1",5,10,Bella,,golden_retriever,10407,46860
883360690899218434,2017-07-07 16:22:55+00:00,Twitter for iPhone,Meet Grizzwald. He may be the floofiest floofer I ever did see. Lost eyes saving a schoolbus from a volcano erpuption. 13/10 heroic as h*ck ,https://twitter.com/dog_rates/status/883360690899218434/photo/1,13,10,Grizzwald,floofer,chow,3825,22986
883117836046086144,2017-07-07 00:17:54+00:00,Twitter for iPhone,"Please only send dogs. We don't rate mechanics, no matter how h*ckin good. Thank you... 13/10 would sneak a pat ","https://twitter.com/dog_rates/status/883117836046086144/photo/1,https://twitter.com/dog_rates/status/883117836046086144/photo/1",13,10,None,,golden_retriever,6949,37914
882992080364220416,2017-07-06 15:58:11+00:00,Twitter for iPhone,This is Rusty. He wasn't ready for the first pic. Clearly puppared for the second. 13/10 confirmed great boy ,"https://twitter.com/dog_rates/status/882992080364220416/photo/1,https://twitter.com/dog_rates/status/882992080364220416/photo/1",13,10,Rusty,,eskimo_dog,4122,24445
882762694511734784,2017-07-06 00:46:41+00:00,Twitter for iPhone,This is Gus. He's quite the cheeky pupper. Already perfected the disinterested wink. 12/10 would let steal my girl ,https://twitter.com/dog_rates/status/882762694511734784/photo/1,12,10,Gus,pupper,labrador_retriever,5134,28903
882627270321602560,2017-07-05 15:48:34+00:00,Twitter for iPhone,This is Stanley. He has his first swim lesson today. Doggle straps adjusted. Ready to go. 13/10 Phelps is nervous (IG: stanleythe_corgi) ,https://twitter.com/dog_rates/status/882627270321602560/photo/1,13,10,Stanley,,pembroke,6342,28382
882268110199369728,2017-07-04 16:01:23+00:00,Twitter for iPhone,This is Alfy. You're witnessing his first watermelon experience. I think it was a success. 13/10 happy 4th Alfy ðŸ‡ºðŸ‡¸ ,"https://twitter.com/dog_rates/status/882268110199369728/photo/1,https://twitter.com/dog_rates/status/882268110199369728/photo/1,https://twitter.com/dog_rates/status/882268110199369728/photo/1",13,10,Alfy,,golden_retriever,12118,45880
882045870035918850,2017-07-04 01:18:17+00:00,Twitter for iPhone,"This is Koko. Her owner, inspired by Barney, recently built a cart for her to use during walks if she got tired. 13/10 rest easy Koko ","https://twitter.com/dog_rates/status/882045870035918850/photo/1,https://twitter.com/dog_rates/status/882045870035918850/photo/1,https://twitter.com/dog_rates/status/882045870035918850/photo/1,https://twitter.com/dog_rates/status/882045870035918850/photo/1",13,10,Koko,,golden_retriever,5203,29900
881906580714921986,2017-07-03 16:04:48+00:00,Twitter for iPhone,This is Rey. He's a Benebop Cumberfloof. 12/10 dangerously pettable ,https://twitter.com/dog_rates/status/881906580714921986/photo/1,12,10,Rey,,weimaraner,3533,24773
881666595344535552,2017-07-03 00:11:11+00:00,Twitter for iPhone,This is Gary. He couldn't miss this puppertunity for a selfie. Flawless focusing skills. 13/10 would boop intensely ,https://twitter.com/dog_rates/status/881666595344535552/photo/1,13,10,Gary,,saluki,11099,51522
881536004380872706,2017-07-02 15:32:16+00:00,Twitter for iPhone,"Here is a pupper approaching maximum borkdrive. Zooming at never before seen speeds. 14/10 paw-inspiring af 
(IG: puffie_the_chow) ",https://twitter.com/dog_rates/status/881536004380872706/video/1,14,10,a,pupper,samoyed,16570,50199
880872448815771648,2017-06-30 19:35:32+00:00,Twitter for iPhone,Ugh not again. We only rate dogs. Please don't send in well-dressed  floppy-tongued street penguins. Dogs only please. Thank you... 12/10 ,https://twitter.com/dog_rates/status/880872448815771648/photo/1,12,10,None,,pembroke,3989,21734
880465832366813184,2017-06-29 16:39:47+00:00,Twitter for iPhone,This is Bella. She had her first beach experience this morning. Complete success. 12/10 would perform a sandy boop ,"https://twitter.com/dog_rates/status/880465832366813184/photo/1,https://twitter.com/dog_rates/status/880465832366813184/photo/1,https://twitter.com/dog_rates/status/880465832366813184/photo/1,https://twitter.com/dog_rates/status/880465832366813184/photo/1",12,10,Bella,,golden_retriever,6546,29075
880221127280381952,2017-06-29 00:27:25+00:00,Twitter for iPhone,Meet Jesse. He's a Fetty Woof. His tongue ejects without warning. A true bleptomaniac. 12/10 would snug well ,"https://twitter.com/dog_rates/status/880221127280381952/photo/1,https://twitter.com/dog_rates/status/880221127280381952/photo/1",12,10,Jesse,,chihuahua,4436,27640
880095782870896641,2017-06-28 16:09:20+00:00,Twitter for iPhone,Please don't send in photos without dogs in them. We're not @porch_rates. Insubordinate and churlish. Pretty good porch tho 11/10 ,https://twitter.com/dog_rates/status/880095782870896641/photo/1,11,10,None,,miniature_pinscher,4533,28150
879862464715927552,2017-06-28 00:42:13+00:00,Twitter for iPhone,This is Romeo. He would like to do an entrance. Requesting your immediate assistance. 13/10 ,"https://twitter.com/dog_rates/status/879862464715927552/photo/1,https://twitter.com/dog_rates/status/879862464715927552/photo/1,https://twitter.com/dog_rates/status/879862464715927552/photo/1",13,10,Romeo,,basset,3642,22667
879492040517615616,2017-06-27 00:10:17+00:00,Twitter for iPhone,This is Bailey. He thinks you should measure ear length for signs of growth instead. 12/10 ,https://twitter.com/dog_rates/status/879492040517615616/photo/1,12,10,Bailey,,german_short-haired_pointer,3323,23822
879415818425184262,2017-06-26 19:07:24+00:00,Twitter for iPhone,This is Duddles. He did an attempt. 13/10 someone help him (vid by Georgia Felici) ,https://twitter.com/dog_rates/status/879415818425184262/video/1,13,10,Duddles,,english_springer,45849,107956
879376492567855104,2017-06-26 16:31:08+00:00,Twitter for iPhone,This is Jack AKA Stephen Furry. You're not scoring on him. Unless he slips down the slide. 12/10 would happily get blocked by ,https://twitter.com/dog_rates/status/879376492567855104/photo/1,12,10,Jack,,labrador_retriever,3261,17099
879008229531029506,2017-06-25 16:07:47+00:00,Twitter for iPhone,This is Beau. That is Beau's balloon. He takes it everywhere. 13/10 would protect at all costs ,https://twitter.com/dog_rates/status/879008229531029506/photo/1,13,10,Beau,,vizsla,2812,19317
878776093423087618,2017-06-25 00:45:22+00:00,Twitter for iPhone,This is Snoopy. He's a proud #PrideMonthPuppo. Impeccable handwriting for not having thumbs. 13/10 would love back #PrideMonth ,"https://twitter.com/dog_rates/status/878776093423087618/photo/1,https://twitter.com/dog_rates/status/878776093423087618/photo/1",13,10,Snoopy,puppo,italian_greyhound,4319,19763
878281511006478336,2017-06-23 16:00:04+00:00,Twitter for iPhone,"Meet Shadow. In an attempt to reach maximum zooming borkdrive, he tore his ACL. Still 13/10 tho. Help him out below

 ","https://www.gofundme.com/3yd6y1c,https://twitter.com/dog_rates/status/878281511006478336/photo/1",13,10,Shadow,,basset,1349,7913
878057613040115712,2017-06-23 01:10:23+00:00,Twitter for iPhone,This is Emmy. She was adopted today. Massive round of pupplause for Emmy and her new family. 14/10 for all involved ,"https://twitter.com/dog_rates/status/878057613040115712/photo/1,https://twitter.com/dog_rates/status/878057613040115712/photo/1",14,10,Emmy,,french_bulldog,7181,42876
877736472329191424,2017-06-22 03:54:17+00:00,Twitter for iPhone,This is Aja. She was just told she's a good dog. Suspicions confirmed. 13/10 would tell again ,"https://twitter.com/dog_rates/status/877736472329191424/photo/1,https://twitter.com/dog_rates/status/877736472329191424/photo/1",13,10,Aja,,chesapeake_bay_retriever,17300,71144
877556246731214848,2017-06-21 15:58:08+00:00,Twitter for iPhone,This is Penny. She's both pupset and fired pup. Not pleased w your barbaric attempts at cleanliness. 12/10 would enjoy more shampoo options ,https://twitter.com/dog_rates/status/877556246731214848/photo/1,12,10,Penny,,basset,3994,23258
877316821321428993,2017-06-21 00:06:44+00:00,Twitter for iPhone,"Meet Dante. At first he wasn't a fan of his new raincoat, then he saw his reflection. H*ckin handsome. 13/10 for water resistant good boy ","https://twitter.com/dog_rates/status/877316821321428993/photo/1,https://twitter.com/dog_rates/status/877316821321428993/photo/1",13,10,Dante,,saluki,5414,27907
877201837425926144,2017-06-20 16:29:50+00:00,Twitter for iPhone,This is Nelly. He graduated with his dogtorate today. Wants to know if you're proud of him. 12/10 would give congratulatory boop ,"https://twitter.com/dog_rates/status/877201837425926144/photo/1,https://twitter.com/dog_rates/status/877201837425926144/photo/1",12,10,Nelly,,pembroke,5880,27755
876838120628539392,2017-06-19 16:24:33+00:00,Twitter for iPhone,This is Ginger. She's having a ruff Monday. Too many pupper things going on. H*ckin exhausting. 12/10 would snug passionately ,"https://twitter.com/dog_rates/status/876838120628539392/photo/1,https://twitter.com/dog_rates/status/876838120628539392/photo/1",12,10,Ginger,pupper,bloodhound,3506,21125
876484053909872640,2017-06-18 16:57:37+00:00,Twitter for iPhone,This is Benedict. He wants to thank you for this delightful urban walk. Hopes you know he loves you. 13/10 super duper good boy ,https://twitter.com/dog_rates/status/876484053909872640/photo/1,13,10,Benedict,,golden_retriever,2511,19163
876120275196170240,2017-06-17 16:52:05+00:00,Twitter for iPhone,"Meet Venti, a seemingly caffeinated puppoccino. She was just informed the weekend would include walks, pats and scritches. 13/10 much excite ",https://twitter.com/dog_rates/status/876120275196170240/photo/1,13,10,Venti,,bernese_mountain_dog,4903,28490
875747767867523072,2017-06-16 16:11:53+00:00,Twitter for iPhone,"This is Goose. He's a womanizer. Cheeky as h*ck, but also deep. Tongue slip game on another level. 13/10 will steal your girl ",https://twitter.com/dog_rates/status/875747767867523072/photo/1,13,10,Goose,,labrador_retriever,4497,25773
875144289856114688,2017-06-15 00:13:52+00:00,Twitter for iPhone,Meet Nugget and Hank. Nugget took Hank's bone. Hank is wondering if you would please return it to him. Both 13/10 would not intervene ,https://twitter.com/dog_rates/status/875144289856114688/video/1,13,10,Nugget,,siberian_husky,5081,22185
875021211251597312,2017-06-14 16:04:48+00:00,Twitter for iPhone,Guys please stop sending pictures without any dogs in th- oh never mind hello excuse me sir. 12/10 stealthy as h*ck ,"https://twitter.com/dog_rates/status/875021211251597312/photo/1,https://twitter.com/dog_rates/status/875021211251597312/photo/1",12,10,None,,west_highland_white_terrier,4922,26022
874680097055178752,2017-06-13 17:29:20+00:00,Twitter for iPhone,Meet Cash. He hath acquired a stick. A very good stick tbh. 12/10 would pat head approvingly ,https://twitter.com/dog_rates/status/874680097055178752/photo/1,12,10,Cash,,labrador_retriever,4875,28439
874296783580663808,2017-06-12 16:06:11+00:00,Twitter for iPhone,This is Jed. He may be the fanciest pupper in the game right now. Knows it too. 13/10 would sign modeling contract ,https://twitter.com/dog_rates/status/874296783580663808/photo/1,13,10,Jed,pupper,cocker_spaniel,4308,26651
874057562936811520,2017-06-12 00:15:36+00:00,Twitter for iPhone,"I can't believe this keeps happening. This, is a birb taking a bath. We only rate dogs. Please only send dogs. Thank you... 12/10 ",https://twitter.com/dog_rates/status/874057562936811520/photo/1,12,10,None,,flat-coated_retriever,4125,23134
874012996292530176,2017-06-11 21:18:31+00:00,Twitter for iPhone,"This is Sebastian. He can't see all the colors of the rainbow, but he can see that this flag makes his human happy. 13/10 #PrideMonth puppo ","https://twitter.com/dog_rates/status/874012996292530176/photo/1,https://twitter.com/dog_rates/status/874012996292530176/photo/1",13,10,Sebastian,puppo,cardigan,11007,35501
873580283840344065,2017-06-10 16:39:04+00:00,Twitter for iPhone,"We usually don't rate Deck-bound Saskatoon Black Bears, but this one is h*ckin flawless. Sneaky tongue slip too. 13/10 would hug firmly ",https://twitter.com/dog_rates/status/873580283840344065/photo/1,13,10,None,,newfoundland,4143,24837
873213775632977920,2017-06-09 16:22:42+00:00,Twitter for iPhone,"This is Sierra. She's one precious pupper. Absolute 12/10. Been in and out of ICU her whole life. Help Sierra below

 ","https://www.gofundme.com/help-my-baby-sierra-get-better,https://twitter.com/dog_rates/status/873213775632977920/photo/1,https://twitter.com/dog_rates/status/873213775632977920/photo/1",12,10,Sierra,pupper,vizsla,1667,7467
872967104147763200,2017-06-09 00:02:31+00:00,Twitter for iPhone,Here's a very large dog. He has a date later. Politely asked this water person to check if his breath is bad. 12/10 good to go doggo ,"https://twitter.com/dog_rates/status/872967104147763200/photo/1,https://twitter.com/dog_rates/status/872967104147763200/photo/1",12,10,None,doggo,labrador_retriever,5669,28031
872820683541237760,2017-06-08 14:20:41+00:00,Twitter for iPhone,"Here are my favorite #dogsatpollingstations 
Most voted for a more consistent walking schedule and to increase daily pats tenfold. All 13/10 ","https://twitter.com/dog_rates/status/872820683541237760/photo/1,https://twitter.com/dog_rates/status/872820683541237760/photo/1,https://twitter.com/dog_rates/status/872820683541237760/photo/1,https://twitter.com/dog_rates/status/872820683541237760/photo/1",13,10,None,,pug,3884,15029
872620804844003328,2017-06-08 01:06:27+00:00,Twitter for iPhone,This is Monkey. She's supporting owners everywhere with her fancy #PrideMonth bandana. 13/10 love is love is love... ,https://twitter.com/dog_rates/status/872620804844003328/photo/1,13,10,Monkey,,cocker_spaniel,3911,21309
872486979161796608,2017-06-07 16:14:40+00:00,Twitter for iPhone,We. Only. Rate. Dogs. Do not send in other things like this fluffy floor shark clearly ready to attack. Get it together guys... 12/10 ,https://twitter.com/dog_rates/status/872486979161796608/photo/1,12,10,None,,pembroke,9429,41606
