tweet_id,timestamp,source,text,expanded_urls,rating_numerator,rating_denominator,name,dog_stage,dog_breed_p,retweet_count,favorite_count
681610798867845120,2015-12-28 23:00:52+00:00,Twitter for iPhone,*collapses* 12/10 ,https://twitter.com/dog_rates/status/681610798867845120/photo/1,12,10,None,,toy_poodle,533,2100
681579835668455424,2015-12-28 20:57:50+00:00,Twitter for iPhone,This is Apollo. He thought you weren't coming back so he had a mental breakdown. 8/10 we've all been there ,https://twitter.com/dog_rates/status/681579835668455424/photo/1,8,10,Apollo,,rottweiler,1489,3893
681523177663676416,2015-12-28 17:12:42+00:00,Twitter for iPhone,This is Carly. She's actually 2 dogs fused together. Very innovative. Probably has superpowers. 12/10 for double dog ,https://twitter.com/dog_rates/status/681523177663676416/photo/1,12,10,Carly,,norfolk_terrier,6620,15749
681339448655802368,2015-12-28 05:02:37+00:00,Twitter for iPhone,This is Asher. He's not wearing a seatbelt or keeping both paws on the wheel. Absolute menace on the roadways. 9/10 ,https://twitter.com/dog_rates/status/681339448655802368/photo/1,9,10,Asher,,labrador_retriever,4598,10202
681320187870711809,2015-12-28 03:46:05+00:00,Twitter for iPhone,This is Glacier. He's a very happy pup. Loves to sing in the sunlight. 11/10 ,https://twitter.com/dog_rates/status/681320187870711809/photo/1,11,10,Glacier,,samoyed,863,2918
681297372102656000,2015-12-28 02:15:26+00:00,Twitter for iPhone,"This is actually a lion. We only rate dogs. For the last time please only send dogs. Thank u.
12/10 would still pet ",https://twitter.com/dog_rates/status/681297372102656000/photo/1,12,10,actually,,lhasa,1091,3490
681281657291280384,2015-12-28 01:12:59+00:00,Twitter for iPhone,Meet Sarge. His parents signed him up for dancing lessons but his true passion is roller coasters 11/10 very petable ,https://twitter.com/dog_rates/status/681281657291280384/photo/1,11,10,Sarge,,saint_bernard,1258,3520
681261549936340994,2015-12-27 23:53:05+00:00,Twitter for iPhone,Say hello to Panda. He's a Quackadilly Shooster. Not amused by your fake ball throwing motion. 9/10 would hug lots ,https://twitter.com/dog_rates/status/681261549936340994/photo/1,9,10,Panda,,tibetan_terrier,308,1597
681231109724700672,2015-12-27 21:52:07+00:00,Twitter for iPhone,I just love this pic. 11/10 this pupper is going places ,https://twitter.com/dog_rates/status/681231109724700672/photo/1,11,10,None,pupper,irish_setter,540,2629
681193455364796417,2015-12-27 19:22:30+00:00,Twitter for iPhone,This is Aspen. He's astronomically fluffy. I wouldn't stop petting this dog if the world was ending around me 11/10 ,"https://twitter.com/dog_rates/status/681193455364796417/photo/1,https://twitter.com/dog_rates/status/681193455364796417/photo/1",11,10,Aspen,,pomeranian,1691,4077
680970795137544192,2015-12-27 04:37:44+00:00,Twitter for iPhone,I thought I made this very clear. We only rate dogs. Stop sending other things like this shark. Thank you... 9/10 ,https://twitter.com/dog_rates/status/680970795137544192/photo/1,9,10,None,,pug,749,2665
680959110691590145,2015-12-27 03:51:18+00:00,Twitter for iPhone,This is Ozzie. He was doing fine until he lost traction in those festive socks. Now he's tired. 9/10 still killin it ,"https://twitter.com/dog_rates/status/680959110691590145/photo/1,https://twitter.com/dog_rates/status/680959110691590145/photo/1,https://twitter.com/dog_rates/status/680959110691590145/photo/1",9,10,Ozzie,,pug,2243,4986
680940246314430465,2015-12-27 02:36:20+00:00,Twitter for iPhone,This is Alice. She's an idiot. 4/10 ,https://twitter.com/dog_rates/status/680940246314430465/photo/1,4,10,Alice,,soft-coated_wheaten_terrier,1225,3544
680934982542561280,2015-12-27 02:15:25+00:00,Twitter for iPhone,Say hello to Sadie. She's a Tortellini Sidewinder. Very jubilant pup. Seems loyal. Leaves on point. 10/10 petable af ,https://twitter.com/dog_rates/status/680934982542561280/photo/1,10,10,Sadie,,labrador_retriever,497,2285
680913438424612864,2015-12-27 00:49:49+00:00,Twitter for iPhone,Meet Griswold. He's dapper as hell. Already pumped for next Christmas. 11/10 ,https://twitter.com/dog_rates/status/680913438424612864/photo/1,11,10,Griswold,,pomeranian,705,2609
680889648562991104,2015-12-26 23:15:17+00:00,Twitter for iPhone,This is Cheesy. It's her birthday. She's patiently waiting to eat her party muffin. 9/10 happy birthday pup ,https://twitter.com/dog_rates/status/680889648562991104/photo/1,9,10,Cheesy,,shetland_sheepdog,418,1945
680836378243002368,2015-12-26 19:43:36+00:00,Twitter for iPhone,This is Ellie. She's secretly ferocious. 12/10 very deadly pupper ,"https://twitter.com/dog_rates/status/680836378243002368/photo/1,https://twitter.com/dog_rates/status/680836378243002368/photo/1,https://twitter.com/dog_rates/status/680836378243002368/photo/1",12,10,Ellie,pupper,pembroke,1513,3766
680801747103793152,2015-12-26 17:25:59+00:00,Twitter for iPhone,Great picture here. Dog on the right panicked &amp; forgot about his tongue. Middle green dog must've fainted. All 10/10 ,https://twitter.com/dog_rates/status/680801747103793152/photo/1,10,10,None,,pug,925,2600
680609293079592961,2015-12-26 04:41:15+00:00,Twitter for iPhone,This is Brody. That is his chair. He loves his chair. Never leaves it. 9/10 might be stuck actually ,https://twitter.com/dog_rates/status/680609293079592961/photo/1,9,10,Brody,,french_bulldog,816,2906
680497766108381184,2015-12-25 21:18:05+00:00,Twitter for iPhone,Meet Percy. He's a Latvian Yuletide Heineken. Refuses to take off sweater. Kinda feisty. 12/10 would keep in pocket ,https://twitter.com/dog_rates/status/680497766108381184/photo/1,12,10,Percy,,chihuahua,2162,4639
680494726643068929,2015-12-25 21:06:00+00:00,Twitter for iPhone,Here we have uncovered an entire battalion of holiday puppers. Average of 11.26/10 ,https://twitter.com/dog_rates/status/680494726643068929/photo/1,26,10,None,,kuvasz,542,1879
680473011644985345,2015-12-25 19:39:43+00:00,Twitter for iPhone,"This is Hector. He thinks he's a hammer. Silly Hector. You're a pupper, not a hammer. 10/10 ",https://twitter.com/dog_rates/status/680473011644985345/photo/1,10,10,Hector,pupper,lakeland_terrier,844,2778
680191257256136705,2015-12-25 01:00:07+00:00,Twitter for iPhone,Here's a sleepy Christmas pupper 11/10 ,https://twitter.com/dog_rates/status/680191257256136705/photo/1,11,10,None,pupper,brittany_spaniel,577,2356
680161097740095489,2015-12-24 23:00:17+00:00,Twitter for iPhone,Meet Goliath. He's an example of irony. Head is phenomenally round. Wants to be an ornament. 12/10 would hug gently ,https://twitter.com/dog_rates/status/680161097740095489/photo/1,12,10,Goliath,,bluetick,828,2538
680145970311643136,2015-12-24 22:00:10+00:00,Twitter for iPhone,Say hello to Kawhi. He was doing fine until his hat fell off. He got it back though. 10/10 deep breaths pupper ,"https://twitter.com/dog_rates/status/680145970311643136/photo/1,https://twitter.com/dog_rates/status/680145970311643136/photo/1,https://twitter.com/dog_rates/status/680145970311643136/photo/1",10,10,Kawhi,pupper,miniature_poodle,1972,3955
680130881361686529,2015-12-24 21:00:12+00:00,Twitter for iPhone,This is Reggie. His Santa hat is a little big. 10/10 he's still having fun ,https://twitter.com/dog_rates/status/680130881361686529/photo/1,10,10,Reggie,,maltese_dog,1078,2519
680115823365742593,2015-12-24 20:00:22+00:00,Twitter for iPhone,This is Ozzy. He woke up 2 minutes before he had to be ready for the Christmas party. 9/10 classic Ozzy ,https://twitter.com/dog_rates/status/680115823365742593/photo/1,9,10,Ozzy,,pug,1028,2972
680100725817409536,2015-12-24 19:00:23+00:00,TweetDeck,This pupper is not coming inside until she catches a snowflake on her tongue. 11/10 the determination is palpable ,https://twitter.com/dog_rates/status/680100725817409536/photo/1,11,10,None,pupper,golden_retriever,1554,3891
680070545539371008,2015-12-24 17:00:27+00:00,TweetDeck,Say hello to Emmie. She's trapped in an ornament. Tragic af. Looks pretty content tho. Maybe it's meant to be. 9/10 ,https://twitter.com/dog_rates/status/680070545539371008/photo/1,9,10,Emmie,,shih-tzu,994,2818
680055455951884288,2015-12-24 16:00:30+00:00,TweetDeck,"Meet Sammy. At first I was like ""that's a snowflake. we only rate dogs,"" but he would've melted by now, so 10/10 ",https://twitter.com/dog_rates/status/680055455951884288/photo/1,10,10,Sammy,,samoyed,8067,18278
679862121895714818,2015-12-24 03:12:15+00:00,Twitter for iPhone,"""Dammit hooman I'm jus trynna lik the fler"" 11/10 ",https://twitter.com/dog_rates/status/679862121895714818/photo/1,11,10,None,,entlebucher,706,2678
679854723806179328,2015-12-24 02:42:51+00:00,Twitter for iPhone,This is Bruce. He's a rare pup. Covered in Frosted Flakes. Nifty gold teeth. Overall good dog. 7/10 would pet firmly ,https://twitter.com/dog_rates/status/679854723806179328/photo/1,7,10,Bruce,,chow,1402,3143
679844490799091713,2015-12-24 02:02:12+00:00,Twitter for iPhone,This is Willie. He's floating away and needs your assistance. Please someone help Willie. 10/10 ,https://twitter.com/dog_rates/status/679844490799091713/photo/1,10,10,Willie,,airedale,887,2593
679828447187857408,2015-12-24 00:58:27+00:00,Twitter for iPhone,Everybody look at this beautiful pupper 13/10 ,"https://twitter.com/dog_rates/status/679828447187857408/photo/1,https://twitter.com/dog_rates/status/679828447187857408/photo/1,https://twitter.com/dog_rates/status/679828447187857408/photo/1",13,10,None,pupper,chihuahua,15839,39726
679777920601223168,2015-12-23 21:37:40+00:00,Twitter for iPhone,This is Rinna. She's melting. 10/10 get inside pupper ,https://twitter.com/dog_rates/status/679777920601223168/photo/1,10,10,Rinna,pupper,bloodhound,1281,3390
679736210798047232,2015-12-23 18:51:56+00:00,Twitter for iPhone,This pup's name is Sabertooth (parents must be cool). Ears for days. Jumps unannounced. 9/10 would pet diligently ,https://twitter.com/dog_rates/status/679736210798047232/photo/1,9,10,None,,french_bulldog,918,2311
679729593985699840,2015-12-23 18:25:38+00:00,Twitter for iPhone,This is Hunter. He was playing with his ball minding his own business. Has no idea what happened to the carpet. 8/10 ,https://twitter.com/dog_rates/status/679729593985699840/photo/1,8,10,Hunter,,west_highland_white_terrier,937,2367
679722016581222400,2015-12-23 17:55:32+00:00,Twitter for iPhone,This is Mike. He is a Jordanian Frito Pilates. Frowning because he can't see directly in front of him. 8/10 ,https://twitter.com/dog_rates/status/679722016581222400/photo/1,8,10,Mike,,boxer,539,1817
679530280114372609,2015-12-23 05:13:38+00:00,Twitter for iPhone,Guys this really needs to stop. We've been over this way too many times. This is a giraffe. We only rate dogs.. 7/10 ,https://twitter.com/dog_rates/status/679530280114372609/photo/1,7,10,a,,dalmatian,2347,5208
679511351870550016,2015-12-23 03:58:25+00:00,Twitter for iPhone,Say hello to William. He makes fun of others because he's terrified of his own deep-seated insecurities. 7/10 ,https://twitter.com/dog_rates/status/679511351870550016/photo/1,7,10,William,,chihuahua,1461,3711
679475951516934144,2015-12-23 01:37:45+00:00,Twitter for iPhone,This is Evy. She doesn't want to be a Koala. 9/10 ,https://twitter.com/dog_rates/status/679475951516934144/photo/1,9,10,Evy,,maltese_dog,728,2304
679462823135686656,2015-12-23 00:45:35+00:00,Twitter for iPhone,Meet Hurley. He's the curly one. He hugs every other dog he sees during his walk. 11/10 for spreading the love ,https://twitter.com/dog_rates/status/679462823135686656/photo/1,11,10,Hurley,,toy_poodle,21324,34856
679158373988876288,2015-12-22 04:35:49+00:00,Twitter for iPhone,This is Rubio. He has too much skin. 11/10 ,https://twitter.com/dog_rates/status/679158373988876288/photo/1,11,10,Rubio,,pug,9193,23568
679148763231985668,2015-12-22 03:57:37+00:00,Twitter for iPhone,I know everyone's excited for Christmas but that doesn't mean you can send in reindeer. We only rate dogs... 8/10 ,https://twitter.com/dog_rates/status/679148763231985668/photo/1,8,10,None,,italian_greyhound,1163,3028
679132435750195208,2015-12-22 02:52:45+00:00,Twitter for iPhone,This is Louis. He's a river dancer. His friends think it's badass. All are very supportive. 10/10 for Louis ,https://twitter.com/dog_rates/status/679132435750195208/photo/1,10,10,Louis,,scottish_deerhound,1314,3253
679111216690831360,2015-12-22 01:28:25+00:00,Twitter for iPhone,This is officially the greatest yawn of all time. 12/10 ,https://twitter.com/dog_rates/status/679111216690831360/video/1,12,10,officially,,kelpie,2893,6514
679062614270468097,2015-12-21 22:15:18+00:00,Twitter for iPhone,This is Chompsky. He lives up to his name. 11/10 ,"https://twitter.com/dog_rates/status/679062614270468097/photo/1,https://twitter.com/dog_rates/status/679062614270468097/photo/1",11,10,Chompsky,,schipperke,9299,18712
679047485189439488,2015-12-21 21:15:11+00:00,Twitter for iPhone,This dog doesn't know how to stairs. Quite tragic really. 9/10 get it together pup ,https://twitter.com/dog_rates/status/679047485189439488/photo/1,9,10,None,,golden_retriever,781,2460
678991772295516161,2015-12-21 17:33:48+00:00,Twitter for iPhone,If your Monday isn't going so well just take a look at this. Both 12/10 ,https://twitter.com/dog_rates/status/678991772295516161/photo/1,12,10,None,,eskimo_dog,1333,2537
678969228704284672,2015-12-21 16:04:13+00:00,Twitter for iPhone,Meet Lola. She's a Metamorphic Chartreuse. Plays with her food. Insubordinate and churlish. Exquisite hardwood 11/10 ,https://twitter.com/dog_rates/status/678969228704284672/photo/1,11,10,Lola,,labrador_retriever,528,1796
678800283649069056,2015-12-21 04:52:53+00:00,Twitter for iPhone,Here's a pupper with some mean tan lines. Snazzy sweater though 12/10 ,https://twitter.com/dog_rates/status/678800283649069056/photo/1,12,10,None,pupper,labrador_retriever,1018,2810
678798276842360832,2015-12-21 04:44:55+00:00,Twitter for iPhone,This is Linda. She fucking hates trees. 7/10 ,https://twitter.com/dog_rates/status/678798276842360832/photo/1,7,10,Linda,,airedale,1350,3804
678774928607469569,2015-12-21 03:12:08+00:00,Twitter for iPhone,This is Tug. He's not required to wear the cone he just wants his voice to project more clearly. 11/10 ,https://twitter.com/dog_rates/status/678774928607469569/photo/1,11,10,Tug,,pembroke,1043,3037
678764513869611008,2015-12-21 02:30:45+00:00,Twitter for iPhone,"Meet Wilson. He got caught humping the futon. He's like ""dude, help me out here"" 10/10 I'd help Wilson out ",https://twitter.com/dog_rates/status/678764513869611008/photo/1,10,10,Wilson,,irish_terrier,544,1788
678755239630127104,2015-12-21 01:53:54+00:00,Twitter for iPhone,This is Dash. He didn't think the water would be that cold. Damn it Dash it's December. Think a little. 10/10 ,https://twitter.com/dog_rates/status/678755239630127104/photo/1,10,10,Dash,,malamute,3741,7802
678740035362037760,2015-12-21 00:53:29+00:00,Twitter for iPhone,Meet Tango. He's a large dog. Doesn't care much for personal space. Owner isn't very accepting. Tongue slip. 6/10 ,https://twitter.com/dog_rates/status/678740035362037760/photo/1,6,10,Tango,,beagle,1926,4099
678643457146150913,2015-12-20 18:29:43+00:00,Twitter for iPhone,Meet Grizz. He just arrived. Couldn't wait until Christmas. Worried bc he saw the swastikas on the carpet. 10/10 ,https://twitter.com/dog_rates/status/678643457146150913/photo/1,10,10,Grizz,,labrador_retriever,489,2250
678446151570427904,2015-12-20 05:25:42+00:00,Twitter for iPhone,Touching scene here. Really stirs up the emotions. The bond between father &amp; son. So beautiful. 10/10 for both pups ,https://twitter.com/dog_rates/status/678446151570427904/photo/1,10,10,None,,staffordshire_bullterrier,1785,4358
678424312106393600,2015-12-20 03:58:55+00:00,Twitter for iPhone,This is Crystal. She's a shitty fireman. No sense of urgency. People could be dying Crystal. 2/10 just irresponsible ,https://twitter.com/dog_rates/status/678424312106393600/photo/1,2,10,Crystal,,maltese_dog,2880,5916
678410210315247616,2015-12-20 03:02:53+00:00,Twitter for iPhone,Say hello to Jerome. He can shoot french fries out of his mouth at insane speeds. Deadly af. 10/10 ,https://twitter.com/dog_rates/status/678410210315247616/photo/1,10,10,Jerome,,schipperke,2072,4640
678399652199309312,2015-12-20 02:20:55+00:00,Twitter for iPhone,This made my day. 12/10 please enjoy ,https://twitter.com/dog_rates/status/678399652199309312/video/1,12,10,None,,bedlington_terrier,30742,61794
678396796259975168,2015-12-20 02:09:34+00:00,Twitter for iPhone,These little fellas have opposite facial expressions. Both 12/10 ,"https://twitter.com/dog_rates/status/678396796259975168/photo/1,https://twitter.com/dog_rates/status/678396796259975168/photo/1",12,10,None,,pembroke,478,1731
678389028614488064,2015-12-20 01:38:42+00:00,Twitter for iPhone,"This is Bella. She just learned that her final grade in chem was a 92.49 
poor pupper 11/10 ",https://twitter.com/dog_rates/status/678389028614488064/photo/1,11,10,Bella,pupper,miniature_pinscher,473,2044
678380236862578688,2015-12-20 01:03:46+00:00,Twitter for iPhone,This is Crumpet. He underestimated the snow. Quickly retreating. 10/10 ,https://twitter.com/dog_rates/status/678380236862578688/photo/1,10,10,Crumpet,,samoyed,1020,2655
678341075375947776,2015-12-19 22:28:09+00:00,Twitter for iPhone,This pupper likes tape. 12/10 ,https://twitter.com/dog_rates/status/678341075375947776/photo/1,12,10,None,pupper,golden_retriever,612,1896
678334497360859136,2015-12-19 22:02:01+00:00,Twitter for iPhone,This is Rosie. She has a snazzy bow tie and a fin for a tail. Probably super fast underwater. Cool socks 10/10 ,https://twitter.com/dog_rates/status/678334497360859136/photo/1,10,10,Rosie,,norfolk_terrier,304,1427
678278586130948096,2015-12-19 18:19:51+00:00,Twitter for iPhone,Another spooky pupper here. Most definitely floating. No legs. Probably knows some dark magic. 10/10 very spooked ,https://twitter.com/dog_rates/status/678278586130948096/photo/1,10,10,None,pupper,maltese_dog,6857,12531
678255464182861824,2015-12-19 16:47:58+00:00,Twitter for iPhone,This is Jessifer. She is a Bismoth Teriyaki. Flowers being attacked by hurricanes on bandana (rad). 9/10 stellar pup ,https://twitter.com/dog_rates/status/678255464182861824/photo/1,9,10,Jessifer,,chihuahua,418,1726
678021115718029313,2015-12-19 01:16:45+00:00,Twitter for iPhone,This is Reese. He likes holding hands. 12/10 ,https://twitter.com/dog_rates/status/678021115718029313/photo/1,12,10,Reese,,miniature_pinscher,7148,15018
677918531514703872,2015-12-18 18:29:07+00:00,Twitter for iPhone,"""Everything looks pretty good in there. Make sure to brush your gums. Been flossing? How's school going?"" Both 10/10 ",https://twitter.com/dog_rates/status/677918531514703872/photo/1,10,10,None,,eskimo_dog,463,1476
677895101218201600,2015-12-18 16:56:01+00:00,Twitter for iPhone,Guys this was terrifying. Really spooked me up. We don't rate ghosts. We rate dogs. Please only send dogs... 9/10 ,https://twitter.com/dog_rates/status/677895101218201600/photo/1,9,10,None,,dalmatian,2384,5275
677716515794329600,2015-12-18 05:06:23+00:00,Twitter for iPhone,IT'S PUPPERGEDDON. Total of 144/120 ...I think ,https://twitter.com/dog_rates/status/677716515794329600/photo/1,144,120,None,,chow,1104,3323
677700003327029250,2015-12-18 04:00:46+00:00,Twitter for iPhone,This is Ralph. He's an interpretive dancer. 10/10 ,https://twitter.com/dog_rates/status/677700003327029250/photo/1,10,10,Ralph,,siberian_husky,1622,3689
677698403548192770,2015-12-18 03:54:25+00:00,Twitter for iPhone,This is Sadie. She got her holidays confused. 9/10 damn it Sadie ,https://twitter.com/dog_rates/status/677698403548192770/photo/1,9,10,Sadie,,shih-tzu,363,1332
677687604918272002,2015-12-18 03:11:30+00:00,Twitter for iPhone,This was Cindy's face when she heard Susan forgot the snacks for after the kid's soccer game. 11/10 ,https://twitter.com/dog_rates/status/677687604918272002/photo/1,11,10,None,,pembroke,950,2681
677673981332312066,2015-12-18 02:17:22+00:00,Twitter for iPhone,Endangered triangular pup here. Could be a wizard. Caught mid-laugh. No legs. Just fluff. Probably a wizard. 9/10 ,https://twitter.com/dog_rates/status/677673981332312066/photo/1,9,10,None,,maltese_dog,1677,3603
677644091929329666,2015-12-18 00:18:36+00:00,Twitter for iPhone,This is a dog swinging. I really enjoyed it so I hope you all do as well. 11/10 ,https://twitter.com/dog_rates/status/677644091929329666/video/1,11,10,a,,chihuahua,886,2040
677565715327688705,2015-12-17 19:07:09+00:00,Twitter for iPhone,Contortionist pup here. Inside pentagram. Clearly worships Satan. Known to slowly push fragile stuff off tables 6/10 ,https://twitter.com/dog_rates/status/677565715327688705/photo/1,6,10,None,,basset,513,1409
677557565589463040,2015-12-17 18:34:46+00:00,Twitter for iPhone,Reckless pupper here. Not even looking at road. Absolute menace. No regard for fellow pupper lives. 10/10 still cute ,https://twitter.com/dog_rates/status/677557565589463040/photo/1,10,10,None,pupper,shih-tzu,1322,2665
677547928504967168,2015-12-17 17:56:29+00:00,Twitter for iPhone,Not much to say here. I just think everyone needs to see this. 12/10 ,https://twitter.com/dog_rates/status/677547928504967168/photo/1,12,10,None,,american_staffordshire_terrier,4076,7568
677530072887205888,2015-12-17 16:45:31+00:00,Twitter for iPhone,Say hello to Axel. He's a Black Chevy Pinot on wheels. 0 to 60 in 5.7 seconds (if downhill). 9/10 I call shotgun ,https://twitter.com/dog_rates/status/677530072887205888/photo/1,9,10,Axel,,staffordshire_bullterrier,250,1161
677334615166730240,2015-12-17 03:48:51+00:00,Twitter for iPhone,This dog gave up mid jump. 9/10 ,"https://twitter.com/dog_rates/status/677334615166730240/photo/1,https://twitter.com/dog_rates/status/677334615166730240/photo/1",9,10,None,,lakeland_terrier,328,1477
677331501395156992,2015-12-17 03:36:28+00:00,Twitter for iPhone,Meet Humphrey. He's a Northern Polyp Viagra. One ear works. Face stuck like that. Always surprised. 9/10 petable af ,https://twitter.com/dog_rates/status/677331501395156992/photo/1,9,10,Humphrey,,beagle,265,1189
677328882937298944,2015-12-17 03:26:04+00:00,Twitter for iPhone,This is Derek. All the dogs adore Derek. He's a great guy. 10/10 really solid pup ,https://twitter.com/dog_rates/status/677328882937298944/photo/1,10,10,Derek,,kelpie,1693,3938
677314812125323265,2015-12-17 02:30:09+00:00,Twitter for iPhone,"Meet Tassy &amp; Bee. Tassy is pretty chill, but Bee is convinced the Ruffles are haunted. 10/10 &amp; 11/10 respectively ","https://twitter.com/dog_rates/status/677314812125323265/photo/1,https://twitter.com/dog_rates/status/677314812125323265/photo/1",10,10,Tassy,,blenheim_spaniel,611,1799
677301033169788928,2015-12-17 01:35:24+00:00,Twitter for iPhone,This is Juckson. He's totally on his way to a nascar race. 5/10 for Juckson ,https://twitter.com/dog_rates/status/677301033169788928/photo/1,5,10,Juckson,,japanese_spaniel,471,1362
677269281705472000,2015-12-16 23:29:14+00:00,Twitter for iPhone,This is the happiest pupper I've ever seen. 10/10 would trade lives with ,https://twitter.com/dog_rates/status/677269281705472000/photo/1,10,10,the,pupper,shetland_sheepdog,790,2164
677187300187611136,2015-12-16 18:03:28+00:00,Twitter for iPhone,Here we see a Byzantine Rigatoni. Very aerodynamic. No eyes. Actually not windy here they just look like that. 9/10 ,https://twitter.com/dog_rates/status/677187300187611136/photo/1,9,10,None,,english_setter,1033,2981
676975532580409345,2015-12-16 04:01:59+00:00,Twitter for iPhone,This is Cooper. He doesn't know how cheese works. Likes the way it feels on his face. Cheeky tongue slip. 11/10 ,https://twitter.com/dog_rates/status/676975532580409345/photo/1,11,10,Cooper,,malamute,1203,3015
676957860086095872,2015-12-16 02:51:45+00:00,Twitter for iPhone,10/10 I'd follow this dog into battle no questions asked ,https://twitter.com/dog_rates/status/676957860086095872/video/1,10,10,None,,labrador_retriever,907,2395
676949632774234114,2015-12-16 02:19:04+00:00,Twitter for iPhone,This is Tyrus. He's a Speckled Centennial Ticonderoga. Terrified of floating red ball. Nifty bandana. 8/10 v petable ,https://twitter.com/dog_rates/status/676949632774234114/photo/1,8,10,Tyrus,,welsh_springer_spaniel,448,1413
676946864479084545,2015-12-16 02:08:04+00:00,Twitter for iPhone,This pups goal was to get all four feet as close to each other as possible. Valiant effort 12/10 ,https://twitter.com/dog_rates/status/676946864479084545/photo/1,12,10,None,,pekinese,426,1844
676936541936185344,2015-12-16 01:27:03+00:00,Twitter for iPhone,Here we see a rare pouched pupper. Ample storage space. Looks alert. Jumps at random. Kicked open that door. 8/10 ,https://twitter.com/dog_rates/status/676936541936185344/photo/1,8,10,None,pupper,chesapeake_bay_retriever,5515,13809
676864501615042560,2015-12-15 20:40:47+00:00,Twitter for iPhone,Meet Ash. He's just a head now. Lost his body during the Third Crusade. Still in good spirits. 10/10 would pet well ,https://twitter.com/dog_rates/status/676864501615042560/photo/1,10,10,Ash,,chesapeake_bay_retriever,808,2294
676821958043033607,2015-12-15 17:51:44+00:00,Twitter for iPhone,Finally some constructive political change in this country. 11/10 ,"https://twitter.com/dog_rates/status/676821958043033607/photo/1,https://twitter.com/dog_rates/status/676821958043033607/photo/1",11,10,None,,great_pyrenees,17605,25124
676819651066732545,2015-12-15 17:42:34+00:00,Twitter for iPhone,Watch out Airbud. This pupper is also good at the sports. 12/10 I'm thinking D1 ,"https://twitter.com/dog_rates/status/676819651066732545/photo/1,https://twitter.com/dog_rates/status/676819651066732545/photo/1",12,10,None,pupper,labrador_retriever,741,1957
